English,Vietnamese
"Spondyloarthritis (A18.0), occipital - axial region",
Imaging abnormalities of other parts of the gastrointestinal tract,
Other extensor tendon and extensor muscles in the forearm,
Cervical femoral nerve syndrome,
prosthesis after vertebral fixation (M96.0),
"Burn and erosion, only on the ankles and feet (T25.-)",
Artery rupture due to trauma see vascular injury,
Lesion of peroneal nerve in the lower leg,
Plasmodium malariae with other Plasmodium species except Plasmodium falciparum and Plasmodium vivax,
"Psoriatic arthritis with distal interphalangeal joint involvement (L40.5), many sites",
Food-induced dermatitis (L27.2),
"Scoliosis due to abnormal thoracic, sacral, and sacral regions",
Fetal and neonatal hemolytic disease,
"Prolonged personality changes, which cannot regulate a lesion or encephalopathy",
"Severe vulvar dysplasia, unclassified elsewhere",
General worker injuries in tra tra tra traffic accident,
Malignant tumors of the salivary gland,
Vaccination against tetanus,
"None, atrophy and congenital anal atresia without fistula",
- Women with tuberculosis pelvic inflammatory disease - (N74.1 *),
"Injured briders when crashing a motor, half-bus, and mild motor: Injured people when up or down the motor.",
"Follow-up care related to reconstructive surgery, unknown",
"Maternal death due to unknown causes occur during pregnancy, during labor, delivery, and postpartum",
3rd degree erosion of the wrist and hand,
"Lesion sequelae were classified as S73-S83.-, S93.- and T13.2",
food deficiency is the cause of food deficiency.,
Traumatic nerve and spinal cord injury,
"Injured motor vehicle drivers when crashing cone vehicle, half-bus, or mild motor vehicle: Injured drivers in non-cycling accidents",
"Joint disease in ulcerative colitis (K51.-), unidentified location",
Other definitive disorder of carbohydrates metabolism,
"Neuromuscular dysfunction, unclassified elsewhere",
The habit of excess alcohol use or mental effects (F10-F19),
Osteoporosis due to malabsorption after surgery with pathologic fracture,
"The lack of synchronization between personal sleep awakening and desired sleep awakening to the personal environment, resulting in complaints of insomnia or heavy sleep.",
Acne-like tumor of the oral mucosa,
"Gastric and duodenal ulcers, unidentified position (or hemorrhage)",
Malignant tumors with invasive lesions of the lip,
"Myositis in other classified infections, the lower leg",
Combined conditions were classified from O99.0 - O99.7,
"When children or adults have severe weight loss, or children do not gain weight leading to standard deviation weight (or a similar weight loss expressed by other statistical methods) When only a data of a weight measured with weight less than the average value of the reference population from 2 - 3 standard deviation, there is a high probability of moderate energy protein malnutrition.",
J17 * Pneumonia in diseases that have been classified elsewhere,
"Other forms of scoliosis, neck and back region",
"Upper respiratory tract disease, nonspecific",
Psychiatric and behavioral disorders due to use of hallucinogens (complicated psychiatric disorder and onset),
Anal and rectal fistula,
Perinatal pulmonary hemorrhage,
Other identified disorders of the parathyroid gland,
"Tumor specialized screening, undefined",
"This study requires a combination of behavioral disorders in children (F91.-) with marked and prolonged emotional symptoms such as anxiety, obsessions or obsessions, personality dissociation or misconceptions, fear or suspicion.",
"Injuries in unidentified motor vehicle crashes, not traffic accidents",
"Dementia develops during HIV disease, while no other disorders or disorders accompany HIV infection so that clinical features can be explained.",
The waiting phase for testing and treatment,
treatment to delay labor (O42.2),
Chagas disease (chronic) affects the nervous system,
"Malignant tumors of the subacute salivary gland are identified, classified based on anatomical region.",
"Exposure to other venomous injuries, identification",
Personal history of gastrointestinal diseases,
Vaginal fistula into the small bowel,
Specific developmental disorders related to learning (F81.-),
"Shock (endotoxin) (hypovolemia)  during or after surgery, procedures",
Other specific congenital anomalies of the skull and face,
- Decreased plasma pro thromboplastin,
"Chronic nephritis, disseminated intravascular proliferative glomerulonephritis",
Car carer injury in other traffic accidents and unidentified,
Other neurologic diseases,
Delivery during or after 37 weeks,
Effects of air pressure and water pressure not determined,
Organic toxicity,
Hyperactivity disorder associated with behavior disorder (F90.1),
"Metal from all sources, except medicinal substances",
Neonatal jaundice due to maternal blood ingestion,
insuline-dependent diabetes mellitus (with renal complications),
Intraventricular hemorrhage (nontraumatic) grade 1 of the fetus and neonate,
Examination to enter the residence site,
Other renal and ureteral changes in other diseases classified elsewhere,
"Flat back syndrome, multiple spine sites",
Heart murmurs and other heart sounds,
"Cutaneous joint disease (E85.-), scapular region",
Other lesions of the lumbar spine,
Influenza and other acute respiratory infections (J00-J22),
Alcohol in the blood is unknown,
Labor and delivery complicated by umbilical cord wraping other parts of the fetus,
Inappropriate position of parents and abnormal education patterns,
Diseases caused by degenerative and vascular diseases of ear,
Non-Hodgkin lymphoma mixed small-diffuse large ( diffuse) small-cell- large ( diffuse) small-cell mixed non-hodgkin,
Application and correction of orthodontic instruments,
Malignant tumors in other sites and are unclear of the respiratory and intrathoracic organs,
house or a arch (W20),
"Acute skin changes due to ultraviolet, atypical",
+ There was a definitive morphological lesion (N02.-),
Hyperuricemia without manifestations of arthritis and calculous disease,
Complications of introducing fertilization in in vitro fertilization,
Blood alcohol level at 60 - 79mg/100ml,
Displaced meniscus due to rupture or old injury of unidentified ligament or unidentified meniscus,
Lesion sequelae classified as S00-,
"Vertebral stenosis in diseases classified elsewhere, occipital - axial",
Fet and neonates affected by premature rupture rupture of membranes,
"Other typical abnormalities of the spine are identified, sacral, and sacral regions",
"The ossification of the adult spine, thoracolumbar region",
People who have all-domestic or other motor vehicles designed primitively for using outside of traffic accident in traffic accident,
"Superficial lesions involving the chest and abdomen, lower back and pelvis",
The specificity of  medicine or medicine appropriate to use correctly,
dehydration as a cause of dehydration:,
Specific disorder of speech and language development (F80.-),
"Exposure to spines, spines, sharp leaves",
"falls from, out of or through:",
Other unidentified air traffic accidents,
"Herniated umbilical hernia with obstructed, necrotic",
+ pneumonia confirmed bacteria with or without sputum culture,
Congenital hypothyroidism with or without goiter (E03.0-E03.1),
Gout disease due to renal dysfunction,
"any condition in I50.-, I51.4 - I51.9 due to hypertension",
"Toxicity Other hypothermic nonopioid analgesics, unclassified elsewhere",
Burns at unidentified body,
Renal vein thrombosis and thrombosis,
"Motorbike injuries during crashing with airbus, raybike: The driver injuries during non-traffic accidents",
"Other complications after immunization, not classified elsewhere",
Motorbike injured during a 2 - 3-cc,
Optic neuropathy and optic path,
- severe vulvar dysplasia of unidentified vulvar (N90.2),
Rheumatoid arthritis with associated organs,
Wearing the opposite's clothing primarily to achieve sexual arousal and to create the external appearance of an individual of the opposite's sexual sexual sexual sexual sexual sexual sexual sexuality in which it is different from transgender-shaped sexuality in which it is markedly associated with sexual arousal and has a desire to exclude strong yourself once it has decreased intensity It may appe,
Toxicity mainly without medical origin,
Complications of unidentified event,
A) Cases that after all detected findings are unlikely to have a specific diagnosis;,
"+ suspected disease, excluded (Z03.-)",
Venous injuries of the dorsal,
Severe drivers are injured during crash with a walker or animals: Injured drivers in non traffic accidents,
- Systemic dystrophy associated with non-neoplastic hematopoietic leukemia (SM- AHNMD),
Osteoarthritis of femoral head in children [Legg-Calvé-Pethès],
Injury of the hip and femoral nerve,
+ kyphosis - Nonspecific or uncombined with scoliosis,
"Pirers injured when crashing a motor, half-bus, and mild motor: Pirers do not identify injured in non-traffic accidents",
People injured injuries in traffic crash between ships or vehicle passage on ray and motor (caused by traffic),
Kidney disease with morphological lesions not identified (N28.9),
Cerebral hemorrhage due to birth,
The adnexal portion of the fallopian tube or extensive ligament,
"- Vaginal intraepithelial neoplasia (VAIN), grade III with or without severe dysplasia",
"falls or motion from  motor motor, no on the ray",
Benign lipomas of skin and subcutaneous tissue in body,
Adhesion  due to inadvertently leaving foreign body in the incision or body cavity,
"Persistent and recurrent hematuria, focal and segmental glomerulonephritis",
"Vulvar endothelial neoplasia [VIN], grade I",
Fixation and adjustment of the prosthesis and other devices (Z44-Z46),
+ unspecified neonatal or neonatal syndrome,
"- Carcinoma, except in bone or tooth pathogens:",
"Fractures classified from S42.-, S52.-, S62.- and T10 of the upper extremity",
"Venous, lymphatic vessels, and lymph nodes are not classified elsewhere",
Other effects and undetermined effects of the height,
Mechanical vascular injury of unidentified body,
- The posterior (laryngeal surface) of the epiglottis,
Cystic lymphoma with or without extensive disease,
Hypoxemia of fetal in utero during labor,
"Dental loss due to accident, extraction, or localized periodontal disease",
Liver and kidney syndrome after delivery,
Deficiency of factor VIII (with decreased function),
Myocardial infarction progressing in other locations,
Lower extremity varices with ulcer,
Other neurological damage caused by zoster,
"Peripheral T-cell lymphoma, unclassified elsewhere",
Cervical mu,
"Myositis in infections that have been classified elsewhere, pelvic, and thigh",
Parkinson's syndrome in other classification,
Determine additional code if desired to determine the underlying disorder,
Drug-related cardiomyopathy,
- Serologic response positive for syphilis,
The unidentified allergic reactions differ from the drugs used correctly (T88.7),
"People who walk off offbus, mild motor vehicle injuries due to crashing with heavy motor vehicle or bus: People who walk on the injured motor vehicle in non-traffic accidents",
Damage of the skin sensory nerve at the ank and feet,
Superficial lesions caused by cold cold only at the wrist and hand (T33.5),
It is usually reserved for low weight but length above the 10th percentile of gestational age.,
"People swing animals or people on a traffically injured motor vehicle, half-bus, mild motor vehicle, heavy motor vehicle or bus vehicle",
"Nonspecific kyphosis, lumbar region",
Motorbike injuries injuries: Motorbike injuries in non traffic accidents,
Regular general health checkup for sports teams,
Postpartum care and examination,
Exposure and exposure to human immunodeficiency virus (HIV),
Injury of the 3 bánh motor motor injured during contact with the walkers or animals,
+ Mucinous colitis F54 and K58.,
Stone in bladder diverticulum (N21.0),
"Workers, mild motor vehicle injuries due to vehicle crashes, raybike: Workers outside the injured motor vehicle in non-traffic accidents",
Eye and adnexal diseases after surgery without other classification,
- Low-grade prostate dysplasia (N42.3),
Severe drivers injuries during crashing with heavy drivers or bus: Injured drivers in non traffic accidents,
Vaccination against some simple viral diseases,
Sex distribution disorder in children age (F64.2),
M09 * Children's arthritis in other classified diseases,
"+ during pregnancy, childbirth and postpartum (O24.-)",
"Advanced nephritis syndrome, disseminated intravascular proliferative glomerulonephritis",
Stenosis of the bile duct without stones,
Any condition in N73.0 determined as acute or chronic,
Other vascular lesions in the forearm,
Toxicity Other nonsteroidal anti-inflammatory drugs (NSAIDs),
Legal and war activities,
+ Combination  of other unidentified gastrointestinal organs,
"Injury due to cold with tissue necrosis of the abdominal, lower back, and pelvis",
Crômat and chromium compounds,
The 3-mm motor drivers injured in non-cross traffic accident: The drivers injured in non-cross traffic accident,
Insufficiency of the labyrinthine,
+ severe depression with psychotic symptoms,
Congenital deformity of skull and facial,
Open wounds of the scrotum and testis,
Cervical tuberculosis (A18.1),
Other congenital anomalies of the biliary tract,
Gallbladder necrosis without gallstones,
Surgical wounds caused by leaf or spine (W60),
"Spontaneous abortion (All unidentified, no complication)",
"Osteonecrosis due to hematopoietic disease (D50-D64), lower leg",
Ulnar artery lesion at the wrist and hand,
"People who wear animals, people on a traffically injured traffic vehicle who are injured by falls or were slipped from animals, and in a non-cycle vehicle.",
Delivery due to complete narrow pelvic stenosis,
Multiple tendon and femoral tendon injuries,
Urethral changes in diseases have been classified elsewhere,
Osteoarthritis associated with extremity paralysis or lower extremity paralysis,
accidents at up and down (V97.1),
Cerebral arteritis in infectious and other types of parasites,
Retinal pigment epithelium (H35.7),
Other identified circulatory disorders in other classification diseases,
Malignant skin tumors of the ear and external ear,
Complications after procedure or surgery  see table,
Motorbike injuries injuries injuries with a walker or animals: The drier injuries in non traffic accidents,
"Diaphragmatic hernia, no obstruction or necrosis",
Congenital anomalies of circulatory system,
Other lesions of the eyes and orbital,
+ Caused by talc or fore substance (T81.6),
"Severe cervical dysplasia, unclassified elsewhere",
"Aortic aneurysm, unidentified position, no rupture",
Neonatal aspiration of amniotic fluid and mucus,
Second-degree burn in the ank and foot,
Delivery due to presentation and other abnormalities,
Food poisoning,
"Impacted teeth are impacted teeth, without obstruction of other teeth.",
Unknown lower extremity paralysis,
Any disorder in I00 with one or more cardiac lesions,
- Nasal tuberculosis - confirming of bacteria and histology,
"Motor, excessive, and compressive bursitis (M70.-)",
Other mononeuropathy in the disease has been classified elsewhere,
Other unidentified causes of death and other non-specific identified diseases,
acquired dyslexia secondary to emotional disorder (F93.-),
Respiratory diseases in other diseases,
Hypoplasia of the aorta in hypoplastic left heart syndrome (Q23.4),
"Vaginitis, vulvitis, and vulvovaginitis in other infections and parasites classified elsewhere",
Complications of head wound,
Injured bike when crushing another injured motor: Injured drivers in non traffic accidents,
Open wounds of the cheek and temporal region of the mandible,
"Other guns and unknown, unknown measures",
Other identified diabetes mellitus (no complication),
Abrasion of 30 - 39% of body surface,
- epiglottis (upper nail bone) unknown (C32.1),
- Congenital anemia due to fetal blood loss (P61.3),
Maternal care for other abnormal pregnancy,
Unidentified type of diabetes mellitus (with renal complications),
Deficiency of other determined nutritional factors,
abuse in young children and old children (F98.3),
HIV disease leads to multiple diseases classified elsewhere,
- Thyrotoxicity with toxic nodular goiter,
Lesion sequelae classified from S82.- S92.- and T12,
Congenital metabolic disorders (E70-E90),
Victims of other identified animal effects,
Hodgkin lymphoma ( other classic),
Other specific disorders of the tympan,
"Tumors of the peripheral nerve of the lower extremities, including the hips",
"Osteonecrosis due to hematopoietic disease (D50-D64), arm",
"Acquired organ loss, unclassified elsewhere",
Other soft-tissue disorders in other classified diseases,
Pregnancy-induced eclampsia or hypertension is available,
Effects of other body regions (T00.8),
Blood alcohol level at 100 - 119mg/100ml,
Other complications of spinal and epidural anesthesia during pregnancy,
Congenital congenital syphilis without other identified after the first 2 years of life,
+ Spondylolisthesis - Nonspecific or uncombined with scoliosis,
The sequelae of central nervous system inflammation,
"Dementia in Alzheimer disease begins before age 65, with relatively rapid degeneration progression and with many marked disorders of high-grade cortical function.",
Multiple organ inflammatory syndrome with COVID-19,
"Joint disease in hypersensitivity reactions has been classified elsewhere, Many sites",
Unidentified accidents related to risk factors,
"This type of behavioral disorder usually occurs in young children, characterized primarily by brushing, nonadherence, clearly irritability, absence of clearly aggressive behavior or antisocial behavior. The disorder requires all criteria in the F91 target, even without severe distortion or antisocial behavior, which must be cautious to diagnose, and should be cautious",
Cutaneous and subcutaneous diseases,
Gallstones with acute cholecystitis,
Malignant tumors of the aortic and other lymph nodes,
"Open wounds were classified as S21.-, S31.- and T09.1",
"Lesion sequelae were classified as S22.2-S22.9, S32.1-S32.5 and S32.8",
"Medical abortion (Incomplete, causing embolic complications)",
"Grade 3 erosion, unidentified body area",
decrease atmospheric pressure when exposed from the surface:,
"Falls on and from stairs, stairs",
"Other viral hemorrhagic fever, unclassified",
High levels of emotional expression in family,
"Injured motor vehicles when crashing a motor, half-bus, or mild motor vehicle: Injured person while up or down the motor vehicle.",
"Toxicity Other antihypertensives, unclassified elsewhere",
Anemia due to glucose-6-phosphate dehydrogenase deficiency,
Traffic accidents causing damage to people,
Other problems related to self-dependence on caregivers,
"COVID-19 vaccination, unknown",
Local carcinoma of the other urinary organs and unidentified,
"Psoriatic arthritis with distal interphalangeal joint involvement (L40.5), unspecified location",
"Myositis in other infections has been classified elsewhere, the arm",
"+ traction, penetrating instruments (W25-W27)",
"Other specified mental disorders due to brain damage, brain dysfunction, and physical disorders",
Basal artery aneurysm and dissection,
Pediatric multi- organ inflammatory syndrome (PIMS) associated with COVID-19,
Hydronephrosis due to renal stones and obstructive ureter,
D80-D89 Disorders related to immune mechanisms,
b) Signs and symptoms appear at the beginning but are transient and no etiology is found.,
"Inner ear disease, other specific inner ear disease",
"Brucellosis spondylitis (A23.-), sacral and sacral regions",
Other complications of surgery and obstetric procedures,
"Lymphadenitis  chronic, any lymph nodes, except mesentery",
blunt  of or on non-motor airway models,
- Neonatal acquired pericardial fluid (P91.1),
"Joint disease in other specific diseases has been classified elsewhere, neck, and feet",
Gallstones  nonspecific or absence of cholangitis or cholecystitis,
Erythrocytosis Queyrat (quy đầu) K (D07.4),
+ Pulmonary distention - Confirmation of microbiology and histology,
People outside the construction injured in tra tra tra traffic accident,
"Toxicity Antidotes and antidotes, unclassified elsewhere",
"Dementia in Alzheimer disease begins, after age 65, usually at the last years of age 70 or later, progresses slowly and with the main feature of memory impairment.",
Lesions of other parts of the head,
Open wounds in the wrist and hand (S61.-),
Female genital fistula (N82.0-N82.1),
related to job and unemployment (Z56.-),
"People who walk on a half-bus, mild motor vehicle are injured when combing with other motor vehicle and are not identified in non-cross-cross-cross accidents",
"There is a alcohol smell in breath, a mild personality disorder in function and response or slightly difficult to regulate motion.",
"Syphilitic diverticulitis (A52.7), neck, and feet",
Osteoarthritis of the neck of the other secondary,
Hereditary palmar and foot keratoses (Q82.8),
"Infection  after infusion, blood transfusion, and injection",
+ traffic vehicle used as traffic vehicle (V01-V99),
Traumatic rupture of thoracic disc,
Training on activities of daily living [ADL] not classified elsewhere,
- primary T cell proliferation CD-30 positive (C86.6),
Class I perineal rupture in delivery,
M03 * Postinfectious arthropathy and reactive arthropathy after other diseases classified elsewhere,
Non- traffic accident identified but unknown mobility of victim,
"Several early complications of trauma, unclassified elsewhere",
"Personality disorders are characterized by suspicious feelings of suspicion, frailty, excessive attention of examination and overconcerned attention to detailed, irritability, caution, and rigidity. Persistent and uncomfortable thoughts or impulses may occur but not reach the severity as in obsessive-deficit disorder.",
Anal and rectal fissure (K60.-),
Loss of the leg on acquired knee,
Gallstones (tracted) in:  nonspecific or absent cholangitis or cholecystitis,
Mendelson syndrome due to anesthesia during pregnancy,
+ Systemic lupus erythematosus (M32.1),
Cranial defects associated with congenital brain abnormalities:,
"Arthritis and fatty skin (E78.8), neck, and feet",
- AML M3 with t(15; 17) and var,
Aerobic traffic accidents causing drowning (drowning) and flooding death: non-activated caterers,
"Drug Poisoning Central effects and nerve blockers cause adrenalin secretion, unclassified elsewhere",
Problems related to socio-economic and psychological situations (Z55-Z65),
Complications of repair of the body,
"- Other identified dotrypanosomakhông disease, the African trypanosoma infection is common",
Hypertrophy  The corpus cavernosa and penis,
Trans traffic accident injury,
"Walkingers injuries due to motor vehicle crashes 2 - 3 bánhes, not identified traffic accidents or non-traffic accidents",
Myopathies in infectious and parasitic diseases classified elsewhere,
"A chronic depressive mood lasts at least years, but is not severe enough or in which the prolonged separate episodes are not sufficient to be diagnosed as mild, moderate, or severe recurrent depressive disorder (F33.-).",
"Congenital malformations of the palate, which are not classified elsewhere",
+ Birth weight  4500g (P08.0),
Granuloma and granuloma of oral mucosa,
Female genital tract infection,
Other venous thrombosis and thrombosis,
Bleeding of other sites of the airway,
"Perineal rupture, fissure (circumferential):",
- Acanthamoeba conjunctivitis (H13.1 *),
The sequelae of unidentified infectious and parasitic infections,
"Traumatic motor vehicle crashes injuries to airport, raybike: Traumatic drivers in non-traffic accidents",
Meningitis and post-infectious myelitis (G04.8),
Facial weakness (facial weakness) due to loss of low-level motor nerve cells,
Hepatic necrosis with liver failure (K72.-),
Detection and recognizing respiratory and psychologic factors identified as risk and harmful,
+ the effect of drug (T88.7),
"Disorders include frequent repetitive bitting episodes that predominate the patient's life and damage their social, occupational, physical, and family values.",
"Gastric ulcers (acute, both hemorrhage and perforation)",
Aplastic  part of the brain,
obstruction - vomiting (reflux food),
Congenital foot and toes deficiency,
Delay in description (without reading disorders),
"Premature rupture of membranes, treated to delay labor",
Other disorders of ear and mastoid,
"Genetic kidney disease, unclassified elsewhere, Disseminated intravascular proliferative glomerulonephritis",
"Single chromosome, mosaic (not dissociated with inoculation)",
Other specific complications of labor and delivery,
+ soap  according to classification status in O00-O07,
- The dorsum of the anterior third of the tongue,
Abnormal results of pulmonary function test,
"Fetal, infants with gestational age of 42 weeks or more (294 days or more) are not severe or enlarged than gestational age.",
Esophageal varices without bleeding in other classification diseases,
Hemorrhagic bruising of fetus and neonate (P54.5),
Joint diseases in other specific diseases have been classified elsewhere,
"Other sexually transmitted infections cause complications for pregnancy, delivery, and postpartum",
"Substantial motorbike, mild motorbike injuries due to vehicle crashes, traffic crashes, traffic crashes: People outside the injured motor crashes in non-traffic accidents",
Trauma and edema of the thoracic cord,
"+ reflux  no other identifiable or identifiable cause, except for low causes.",
Delivery due to shoulder presentation,
