English,Vietnamese
,Đối tượng và phương pháp nghiên cứu: Nghiên cứu mô tả 57 bệnh nhân với 57 khớp gối được chẩn đoán viêm khớp nhiễm khuẩn được phẫu thuật nội soi từ tháng 9/2018 đến tháng 9/2020 tại khoa Chấn thương Chỉnh hình - Cột sống - Bệnh viện Bạch Mai. Kết quả sau mổ được đánh giá bằng thang điểm đánh giá kết quả tổn thương khớp gối và điểm kết cục thoái hoá khớp (KOOS).
,Tỷ lệ giãn phế quản ở bệnh nhân đợt cấp bệnh phổi tắc nghẽn mạn tính
,Mô tả tái tạo khuyết hổng họng sau phẫu thuật cắt thanh quản toàn phần bằng vạt đảo động mạch thượng đòn.
,Đối tượng và phương pháp: Bệnh nhân được chẩn đoán ung thư hạ họng được phẫu thuật cắt toàn bộ thanh quản và tạo hình khuyết hổng hạ họng bằng vạt đảo động mạch thượng đòn.
,"Kết quả: khối u được cắt bỏ hoàn toàn với rìa âm tính, vạt sống và liền tốt sau mổ 8 tuần, không mất vạt, không rò họng, không hẹp miệng nối và chức năng nuốt tốt."
,"Kết luận: tạo hình khuyết hổng họng bằng vạt đảo động mạch thượng đòn là kỹ thuật dễ thực hiện và nhanh chóng, vạt trên xương đòn là vạt cuống, phù hợp để tạo hình khuyết hổng họng, dễ sống và liền tốt với niêm mạc họng."
,So sánh tỷ lệ tồn dư sau phẫu thuật nội soi ở bệnh nhân có hoặc không có theo dõi bằng tof
,"Các thông tin khác cũng được ghi nhận: dấu hiệu, triệu chứng, tiền sử, bạch cầu, CRP, hô hấp ký... Kết quả: 97 bệnh nhân đợt cấp BPTNMT, nam chiếm 92,8%, tuổi trung bình 67  10, hút thuốc lá chiếm 90,7%, đa số chức năng phổi của bệnh nhân là GOLD 3 FEV1 45,2%, lao phổi trước đó 40,2%."
,"Tỷ lệ giãn phế quản là 36,6%. Kết luận: đợt cấp COPD có tỷ lệ giãn phế quản và giãn phế quản là 36%."
,"Đặc điểm lâm sàng, xét nghiệm của bệnh nhân PNH điều trị tại Viện Huyết học - Truyền máu Trung ương"
,"Khi phẫu thuật nội soi ngày càng trở nên phổ biến, quá trình bơm hơi ổ bụng đã đưa ra nhiều thay đổi cho tim mạch và hệ hô hấp."
,"Trong khi ERAS khuyến cáo bác sĩ gây mê nên sử dụng thuốc giãn cơ sâu trong phẫu thuật nội soi để tránh các tác dụng phụ, phương pháp này có thể gây nguy cơ giãn cơ tồn dư sau phẫu thuật."
,Nghiên cứu nhằm so sánh tỷ lệ tồn dư sau mổ giữa nhóm bệnh nhân có hoặc không có theo dõi TOF Watch.
,"Nghiên cứu tiến cứu, thử nghiệm lâm sàng ngẫu nhiên trên 60 bệnh nhân được chia làm 2 nhóm, tại Bệnh viện Việt Đức từ tháng 4 đến tháng 11 năm 2017."
,"Kết quả: Tuổi, giới, ASA, thời gian phẫu thuật, thời gian gây mê, loại phẫu thuật tương đương nhau ở hai nhóm."
,"Nhóm không được theo dõi bằng máy TOF Watch có tỷ lệ tồn dư sau rút nội khí quản cao hơn nhóm được theo dõi, sự khác biệt có ý nghĩa thống kê với p  0,05 tại các thời điểm 1, 10, 20 phút."
,"Tại thời điểm 30 phút sau rút nội khí quản, cả 2 nhóm (3,33% ở nhóm theo dõi so với 13,13% ở nhóm không theo dõi) vẫn còn tồn dư dịch rửa."
,"Nhóm không theo dõi có tỷ lệ triệu chứng suy hô hấp cao hơn trong 30 phút đầu sau rút nội khí quản, 2 bệnh nhân (6,67%) ở nhóm này có SpO2 dưới 93%; nhóm theo dõi không có bệnh nhân suy hô hấp."
,"Kết luận: Bệnh nhân được theo dõi bằng máy TOF Watch có tỷ lệ tồn dư sau rút nội khí quản thấp hơn, tuy nhiên nguy cơ tái lập không hoàn toàn."
,Các yếu tố nguy cơ chảy máu tái phát ở bệnh nhân dị dạng hang não
,"Mô tả đặc điểm lâm sàng, cận lâm sàng của huyết sắc tố kịch phát về đêm tại Viện Huyết học - Truyền máu Trung ương năm 2010 - 2020."
,"Sự khó khăn CD55, CD59 đơn thuần chủ yếu gặp ở nhóm PNH có rối loạn tuỷ xương."
,"Kết luận: Các đặc điểm lâm sàng của bệnh nhân PNH chủ yếu là mệt mỏi và thiếu máu, các triệu chứng rối loạn trương lực cơ trơn và huyết khối ít gặp."
,Đặc điểm cận lâm sàng của bệnh nhân PNH chủ yếu là thiếu máu tán huyết.
,Nhóm PNH cổ điển có thiếu máu tan máu và thiếu sắt nhiều hơn nhóm còn lại.
,"Sự thiếu hụt CD55, CD59 bạch cầu đơn thuần được tìm thấy chủ yếu ở nhóm PNH có rối loạn tuỷ."
,Đối tượng và phương pháp nghiên cứu: 116 bệnh nhân được chẩn đoán xác định PNH điều trị tại Viện Huyết học - Truyền máu Trung ương từ năm 2010 - 2020.
,"Kết quả: Triệu chứng lâm sàng thường gặp nhất: thiếu máu (92,2%), mệt mỏi (88,8%), vàng da (36,2%), tiểu sẫm màu (50,8%)."
,"41,4% (4 8/11 6) bệnh nhân PNH có tiền sử bệnh máu trước đó, trong đó AA (41,7%); MDS (25%) thiếu máu thiếu sắt (8,3%), thiếu máu nhẹ (39,7%), thiếu máu vừa (38,8%), thiếu máu nặng (21,6%)."
,"Đa số bệnh nhân có thiếu máu hồng cầu to (66,4%); 7,8% bệnh nhân có thiếu máu hồng cầu nhỏ."
,Tỷ lệ tan máu và thiếu sắt ở bệnh nhân PNH cổ điển cao hơn nhóm PNH có rối loạn tuỷ xương.
,"CD55, CD59 trên bạch cầu thiếu hụt nhiều hơn hồng cầu."
,"Thiếu hồng cầu là phổ biến 20-60%, trên bạch cầu đa nhân trung tính là phổ biến > 80%."
,"Nghiên cứu sự thay đổi tuổi dậy thì của học sinh trường trung học cơ sở huyện Vụ Bản, tỉnh Nam Định"
,"Đặt vấn đề: Những thay đổi tâm lý trong độ tuổi dậy thì ảnh hưởng đáng kể đến cuộc sống và học tập của thanh thiếu niên, vì vậy việc hiểu biết về các dấu hiệu dậy thì rất quan trọng trong việc giúp cha mẹ, thầy cô và nhà trường cùng với trẻ đi qua giai đoạn này một cách an toàn."
,Mục tiêu: Khảo sát đặc điểm dậy thì ở trẻ trai và trẻ gái tại trường THCS thị trấn Goi Town.
,Đối tượng và phương pháp nghiên cứu: Nghiên cứu mô tả cắt ngang với 400 trẻ trai và trẻ gái tại trường THCS Thị Trấn Goi Town năm 2019.
,"Kết quả: Trẻ gái bị mụn trứng cá trên mặt chiếm 70,5%, trẻ trai bị mụn trứng cá trên mặt chiếm 51,0%; tỷ lệ mọc lông mu tăng dần theo tuổi; lông mu cũng là một trong những dấu hiệu điển hình của tuổi dậy thì, tuy nhiên nó không xuất hiện sớm và phổ biến như lông mu; Tuổi trung bình của trẻ gái có kinh nguyệt lần đầu (13 tuổi) là 14,5%; trẻ gái có kinh nguyệt lần đầu (13 tuổi) là 14,5%; trẻ có kinh nguyệt lần đầu (13 tuổi) là"
,Đặc điểm kiểu hình của các đợt cấp rối loạn chu trình urê mất bù
,Phân tích các yếu tố nguy cơ chảy máu tái phát của bệnh nhân u mạch hang tại Bệnh viện Bạch Mai từ tháng 8/2018 đến tháng 8/2019.
,Đối tượng và phương pháp: Nghiên cứu mô tả cắt ngang được thực hiện trên 45 bệnh nhân.
,"Kết quả: Tỷ lệ nam / nữ là 1/1, tuổi trung bình của đối tượng nghiên cứu là 43,6."
,"Vị trí tổn thương có 53,4% trường hợp tổn thương nằm trên lều tiểu não, 42,2% trường hợp tổn thương nằm dưới lều tiểu não và 4,4% trường hợp tổn thương cả trên và dưới lều tiểu não, trong 45 bệnh nhân có 52 tổn thương, trong đó tổn thương hay gặp nhất là thuỳ trán 21,1%, kế đến là thuỳ chẩm 17,3%."
,"Đa số bệnh nhân có tổn thương dưới 30mm (96,2%), tổn thương thường có tín hiệu hỗn hợp trên mạch T1W (55,6%), hỗn hợp trên mạch T2W (53,3%), mất tín hiệu trên T2 * (100%)."
,"Không có mối liên quan giữa chảy máu tái phát với tuổi (p  0,486), giới (p  0,912), vị trí (p  0,512), kích thước tổn thương (p  0,456)."
,"Kết luận: U máu thể hang xuất hiện ở cả hai giới với tỷ lệ tương đương, tuổi và giới của bệnh nhân, vị trí và kích thước của tổn thương không phải là yếu tố nguy cơ của xuất huyết não tái phát."
,Đánh giá kết quả phẫu thuật cắt đại tràng sigma điều trị ung thư trực tràng cao tại Bệnh viện Đa khoa tỉnh Thái Bình
,"Đặc điểm lâm sàng của đợt cấp lần 1 của 32 bệnh nhân là: tuổi khởi phát trung vị là 25 tháng (3 ngày - 108 tháng), hội chứng não cấp với nôn (81,3%), bú kém (75%), sau đó hôn mê / li bì (71,9%) và co giật (15,6%)."
,"Đặc điểm sinh hoá của cơn cấp lần 1: tăng ammoniac máu (65,6%) với trung vị 402 mol / l (184-1304 mol / l), tăng men gan (70%), giảm thời gian prothrombin (86,4%)."
,"Đa số bệnh nhân nhập viện trong tình trạng nặng với 95% tăng lactate máu và 33,3% toan chuyển hoá."
,Kết luận: Các đợt cấp của UCD có thể xảy ra ở mọi lứa tuổi với các đặc điểm của hội chứng não cấp.
,Xét nghiệm amoniac huyết tương thường quy cho tất cả các bệnh nhân bị bệnh não cấp tính là cần thiết để tránh chẩn đoán muộn.
,"Đặc điểm lâm sàng, cận lâm sàng u buồng trứng ở phụ nữ mang thai tại Bệnh viện Phụ sản Thái Bình từ năm 2015 đến năm 2019"
,Ung thư trực tràng cao là một khối u ở trực tràng cách bờ hậu môn 10 cm.
,"Giai đoạn I, II và III là 5,9%; 53% và 41,1%."
,"Phẫu thuật đơn thuần 3,9%; phẫu thuật kết hợp hoá trị và xạ trị 96,1%."
,"Phẫu thuật mở 74,5%; phẫu thuật nội soi 25,5%."
,"Thời gian phẫu thuật trung bình 160,2 phút; Thời gian có nhu động ruột trở lại 3,2 ngày; Thời gian dùng thuốc giảm đau trung bình 4,6 ngày; Thời gian nằm viện trung bình 10,3 ngày; Có sự khác biệt có ý nghĩa thống kê giữa kết quả phẫu thuật mở và phẫu thuật nội soi."
,"Rò miệng nối 2%; nhiễm trùng vết mổ 7,8%."
,"Thời gian theo dõi sau mổ trung bình là 17,5 tháng."
,"Số lần đại tiện trung bình 1 năm sau mổ là 2,1 lần."
,"Thời gian sống thêm toàn bộ và không bệnh lần lượt là 27,2 và 27,6 tháng."
,"Phẫu thuật cắt đoạn đại tràng sigma, nạo vét hạch di căn và nối đại trực tràng bằng stapler đã được thực hiện nhiều năm tại Bệnh viện Đa khoa tỉnh Thái Bình cho kết quả tốt."
,Không có yếu tố nào liên quan đến thời gian sống thêm sau mổ.
,"Kết luận: Phẫu thuật cắt đoạn đại tràng sigma và nối đại trực tràng bằng stapler điều trị ung thư trực tràng cao tại Bệnh viện Đa khoa tỉnh Thái Bình là một phương pháp an toàn, cho kết quả tốt."
,Nghiên cứu nhằm đánh giá kết quả của phẫu thuật này.
,Đối tượng và phương pháp nghiên cứu: 51 bệnh nhân ung thư trực tràng cao được phẫu thuật cắt đại tràng sigma và nối đại trực tràng bằng stapler tại Bệnh viện Đa khoa tỉnh Thái Bình từ tháng 1/2019 đến tháng 12/2020.
,"Ghi nhận các số liệu về tuổi, giới, đặc điểm khối u, giai đoạn bệnh; phương pháp phẫu thuật, thời gian phẫu thuật, biến chứng và biến chứng của phẫu thuật; số lần đại tiện sau mổ."
,"Tỷ lệ sống, tỷ lệ tái phát, thời gian sống thêm sau mổ."
,Kết quả: 51 bệnh nhân ung thư trực tràng cao được phẫu thuật cắt đại tràng sigma và nối đại trực tràng bằng stapler.
,"Tuổi trung bình là 63,9 tuổi."
,Nghiên cứu đặc điểm lâm sàng và hình ảnh nội soi viêm tai giữa cấp ở trẻ em tại Bệnh viện E từ năm 2019  2020
,Nghiên cứu này nhằm so sánh kiến thức và thực hành của nam và nữ đối với việc rửa tay và đeo khẩu trang trong đại dịch COVID-19 tại bệnh viện Thống Nhất. Đối tượng và phương pháp nghiên cứu: Chúng tôi tiến hành nghiên cứu cắt ngang trên những bệnh nhân đến khám ngoại trú tại bệnh viện Thống Nhất từ tháng 5/2020 đến tháng 7/2020.
,Các nhà nghiên cứu phỏng vấn trực tiếp bệnh nhân bằng bộ câu hỏi soạn sẵn.
,"Kết quả: Tổng cộng có 1.555 bệnh nhân được đưa vào nghiên cứu với 804 nam (51,7%) và 751 nữ (48,3%)."
,"Có sự khác biệt có ý nghĩa thống kê giữa nam và nữ về tuổi, trình độ học vấn và tình trạng làm việc (p  0,001)."
,"Hơn 80% người bệnh ở cả 2 nhóm thường xuyên rửa tay bằng xà phòng hoặc xà phòng, 83,2% ở nam và 85,4% ở nữ (p  0,230)."
,"Gần như tất cả bệnh nhân ở cả hai nhóm đều đeo khẩu trang khi ra viện trong tháng qua (98,9% với 98,1%, p  0,224)."
,Kết luận: Kết quả cho thấy không có sự khác biệt về kiến thức và thực hành rửa tay và đeo khẩu trang trong đại dịch COVID-19.
,Tác dụng phụ của methotrexate trong điều trị tân sinh nguyên bào nuôi
,Viêm tai giữa cấp (AOM) là tình trạng nhiễm trùng và tích tụ dịch trong tai giữa.
,"Bệnh thường khởi phát đột ngột và trong thời gian ngắn, với các triệu chứng lâm sàng liên quan đến hình ảnh nội soi."
,Mục tiêu: Mô tả đặc điểm lâm sàng viêm tai giữa cấp ở trẻ em tại Bệnh viện E từ năm 2019  2020.
,"Đối tượng và phương pháp nghiên cứu: Nghiên cứu mô tả cắt ngang, gồm 40 bệnh nhân dưới 16 tuổi, được chẩn đoán AOM, điều trị tại khoa Tai Mũi Họng bệnh viện E từ tháng 9/2019 đến tháng 4/2020."
,"Kết quả và bàn luận: Sốt nhẹ: 37,5%, sốt vừa: 20%, sốt cao: 22,5%; Đau tai nhẹ chiếm 40%, đau tai nặng 25%; Không chảy dịch tai 77,5%, chảy dịch tai chiếm 22,5%; Tràn dịch màng nhĩ ứ mủ chiếm 35%, tràn mủ màng nhĩ 42,5%, thủng màng nhĩ 42,5%."
,"Kết luận: Kết hợp các triệu chứng lâm sàng và hình ảnh nội soi để chẩn đoán chính xác và chẩn đoán giai đoạn viêm tai giữa cấp, từ đó đưa ra hướng dẫn điều trị cụ thể và phù hợp."
,Trạng thái động kinh kháng trị mới khởi phát: Báo cáo ca lâm sàng và tổng quan y văn
,"Trong số 47 trường hợp tăng men gan, 16 trường hợp xuất hiện sau 1 chu kỳ điều trị, 14 trường hợp xuất hiện sau 2 chu kỳ và 9 trường hợp xuất hiện sau 3 chu kỳ và sau 4, 5 và 6 chu kỳ, chỉ có 4, 2, 1 trường hợp tăng men gan."
,Không có trường hợp nào sau chu kỳ điều trị 100% và 100%.
,"Ở bệnh nhân AST trước điều trị > 25 UI / L, nguy cơ tăng men gan cao gấp 2,29 lần so với bệnh nhân AST trước điều trị  25 UI / L."
,"Dựa trên mô hình hồi quy Cox, chúng tôi xây dựng được biểu đồ gồm 4 biến số: tuổi, BMI, AST trước điều trị và ALT trước điều trị."
,"Các tác dụng không mong muốn khác bao gồm loét miệng, tiêu chảy, nôn, rụng tóc, xảy ra với tỷ lệ lần lượt là 18,4%, 14,7%, 10,4% và 4,9%."
,Hầu hết các phản ứng này là nhẹ và không cần điều trị đặc hiệu.
,"Kết luận: Tỷ lệ tăng men gan chung là 28,83%, thường xảy ra trong vòng 3 đến 4 chu kỳ điều trị đầu tiên."
,AST trước điều trị có liên quan đến tăng men gan.
,"Ước tính có thể xác định nguy cơ tăng men gan ở bệnh nhân có bệnh nguyên bào nuôi có nguy cơ thấp, điều trị bằng methotrexate và axit folinic."
,Mục tiêu: Xác định tỷ lệ và các yếu tố liên quan đến tăng men gan ở bệnh nhân bệnh nguyên bào nuôi nguy cơ thấp điều trị methotrexate.
,"Chúng tôi chọn toàn bộ 163 trường hợp bệnh nguyên bào nuôi có nguy cơ thấp, điều trị bằng methotrexate và axit folinic, từ tháng 10/2019 đến tháng 6/2020 tại bệnh viện Từ Dũ."
,Phân tích sống còn Kaplan-Meier được thực hiện để xác định tỷ lệ tăng men gan theo thời gian.
,Chúng tôi áp dụng mô hình hồi quy Cox để xác định các yếu tố liên quan đến tăng men gan và xây dựng biểu đồ dự đoán nguy cơ tăng men gan.
,"Kết quả: Tỷ lệ tăng men gan là 28,83%."
,Đặc điểm lâm sàng trầm cảm ở bệnh nhân viêm khớp dạng thấp và một số yếu tố liên quan ở bệnh nhân viêm khớp dạng thấp tại khoa cơ xương khớp  Bệnh viện Bạch Mai
,"Báo cáo kết quả điều trị thành công một trường hợp động kinh kháng trị mới khởi phát tại Khoa Thần kinh, Bệnh viện Trung ương Quân đội 108 và hồi cứu y văn về tình trạng bệnh lý hiếm gặp này."
,"Đối tượng và phương pháp: Báo cáo ca bệnh, tổng quan tài liệu."
,Kết quả: Kết quả tốt tại thời điểm 2 tháng dựa trên sự kết hợp giữa kinh nghiệm và bằng chứng.
,"Kết luận: Trạng thái động kinh kháng trị mới khởi phát là một tình trạng bệnh lý hiếm gặp, tiên lượng xấu, có nguy cơ biến đổi cao trong trạng thái động kinh kháng trị, tỷ lệ tử vong và biến chứng cao."
,Liệu pháp điều hoà miễn dịch được xem xét trong điều trị tình trạng này.
,Kết quả điều trị gãy đầu dưới xương đùi bằng nẹp vít khoá ở người lớn tại Bệnh viện Trung ương Thái Nguyên
,"Rối loạn trầm cảm là một bệnh lý kèm theo thường gặp trong bệnh viêm khớp dạng thấp (VKDT), điều này sẽ làm cho các triệu chứng VKDT trở nên tồi tệ hơn, các biến chứng tăng lên, tỷ lệ tử vong và tự tử tăng lên, là gánh nặng nặng nề cho bệnh nhân, gia đình và xã hội."
,Đã có nhiều nghiên cứu về rối loạn trầm cảm ở bệnh nhân viêm khớp dạng thấp trên thế giới nhưng vẫn chưa có báo cáo ở Việt Nam.
,"Do đó, chúng tôi thực hiện đề tài Chẩn đoán trầm cảm và một số yếu tố liên quan ở bệnh nhân viêm khớp dạng thấp tại khoa Nội cơ xương khớp  Bệnh viện Bạch Mai ."
,Đối tượng và phương pháp nghiên cứu: Nghiên cứu mô tả cắt ngang 79 bệnh nhân viêm khớp dạng thấp điều trị nội trú tại Khoa Cơ Xương Khớp Bệnh viện Bạch Mai từ tháng 6/2019 đến tháng 6/2020.
,"Kết quả: Đối tượng nghiên cứu chủ yếu là nữ giới (83,5%), tuổi trung bình là 60,9  9,3, ở thành thị tương đương với nông thôn, 40,5% là học vấn trung học cơ sở."
,"Có 51,9% bệnh nhân trầm cảm theo thang điểm Hamilton Depression Scale (HAM  D)."
,"Có sự khác biệt có ý nghĩa thống kê về số khớp đau và sưng tấy, chỉ số CRP, chỉ số hoạt động bệnh ở 28 khớp sau CRP (DAS 28 - CRP) ở bệnh nhân trầm cảm và bệnh nhân không trầm cảm."
,"Những bệnh nhân không thể lao động, làm các hoạt động sinh hoạt hàng ngày hoặc làm tiền có tỷ lệ trầm cảm cao hơn những người còn lại vẫn còn khả năng lao động và các hoạt động sinh hoạt hàng ngày với p  0,05."
,Kết quả bước đầu phẫu thuật đĩa đệm cột sống cổ trước sử dụng hệ thống interlock
,"Gãy đầu dưới xương đùi là một loại gãy xương lớn, phức tạp, thường ảnh hưởng đến chức năng vận động của khớp gối."
,"Kết quả phục hồi chức năng theo Sanders. R: tốt: 63,8%, khá: 18,5%, trung bình: 12,1% và kém: 3,0%."
,"Kết luận: Kết quả điều trị gãy đầu dưới xương đùi bằng nẹp khoá là rất khả quan, trong đó có bệnh nhân cao tuổi có loãng xương, hiện nay là lựa chọn điều trị tối ưu cho loại gãy này."
,"Nẹp khoá đầu dưới xương đùi giúp cố định vững chắc gãy xương, phục hồi chức năng sớm."
,Mục tiêu: Đánh giá kết quả điều trị gãy đầu dưới xương đùi bằng nẹp khoá ở người lớn.
,Đối tượng và phương pháp nghiên cứu: Mô tả cắt ngang.
,"Từ tháng 01/2018 đến tháng 06/2021, 33 bệnh nhân, từ 18 tuổi trở lên bị gãy đầu dưới xương đùi được điều trị bằng nẹp khoá và theo dõi ít nhất 6 tháng."
,"Kết quả: Có 12 (36,4%) nam và 21 (63,6%) nữ."
,Tỷ lệ liền xương là 100%.
,"Kết quả nắn chỉnh gãy trên X-quang theo Larson  Bostman: Tốt: 97,0%, khá: 3,0%."
,"Biên độ vận động khớp gối: 54,5% đạt gấp gối hoàn toàn  1250, 24,2% từ 1000-1240, 15,2% từ 900-990,6% gấp gối  900."
,Thực trạng tuân thủ điều trị arv của bệnh nhân HIV/AIDS tại phòng khám ngoại trú Bệnh viện Đa khoa tỉnh Nam Định năm 2016
,Xác định thực trạng tuân thủ điều trị ARV của bệnh nhân HIV / AIDS và tìm hiểu một số yếu tố ảnh hưởng đến tuân thủ điều trị ARV.
,"Kết quả: Trong số 256 người tham gia nghiên cứu, 47,7% là nữ, 52,3% là nam, 57,8% là ở ngoại thành."
,"Tỷ lệ tuân thủ điều trị chung là 79,7% và tuân thủ điều trị chung là 20,3%."
,Nghiên cứu kết quả điều trị trứng cá thông thường bằng isotretinoin và vitamin D đường uống
,Phẫu thuật cắt đĩa đệm và hàn xương (ACDF) được chỉ định rộng rãi cho thoát vị đĩa đệm cột sống cổ do thoái hoá hoặc đa tầng.
,"Đánh giá trước và sau mổ về góc cổ tử cung, thời gian phẫu thuật, lượng máu mất cũng như các biến chứng cũng được đánh giá."
,"Tất cả bệnh nhân đều cải thiện tốt tình trạng chèn ép rễ thần kinh và đau cổ, cải thiện NDI và cải thiện độ ưỡn."
,Thời gian phẫu thuật và lượng máu mất được giảm thiểu.
,Không có rối loạn nuốt hay biến chứng chung.
,"Phẫu thuật ACDF sử dụng khoá kéo cho kết quả tốt, duy trì được chiều dài cổ tử cung, thời gian phẫu thuật, lượng máu mất và hiện tại không ghi nhận biến chứng sau mổ bao gồm khó nuốt."
,"Tuy nhiên, chúng cũng gặp phải các biến chứng như tổn thương mô mềm gây phù nề thực quản, khó nuốt, đặc biệt là trong phẫu thuật đa tầng."
,"Phẫu thuật ghép đĩa đệm liên mấu chuyển được thực hiện để đảm bảo tỷ lệ hàn xương tối đa, ít biến chứng, khó nuốt và thời gian phẫu thuật."
,"Đến cuối năm 2019, hệ thống này đã được FDA chấp thuận trong phẫu thuật đa tầng cột sống cổ."
,"Tại khoa A, Bệnh viện Đại học Y Hà Nội, chúng tôi đã áp dụng và thu được kết quả bước đầu thuận lợi."
,Đây là một nghiên cứu tiền cứu mô tả cắt ngang trên 10 bệnh nhân thoát vị đĩa đệm cột sống cổ do thoái hoá.
,"Bệnh nhân được đánh giá các triệu chứng lâm sàng trước và sau mổ theo phác đồ, thang điểm đau VAS (Visual Analogue Scale), thang điểm đau NDI (Neck Disability Index) và thang điểm khó nuốt."
,Kết quả phẫu thuật thay van động mạch chủ ít xâm lấn mở ngực phải tại Bệnh viện Tim Hà Nội
,Đánh giá kết quả điều trị trứng cá thông thường bằng isotretinoin và vitamin D (Vit D) đường uống.
,"Đối tượng và phương pháp: Thử nghiệm lâm sàng có đối chứng, so sánh hiệu quả điều trị của 70 bệnh nhân trứng cá thông thường mức độ trung bình và nặng."
,"Bệnh nhân được chia ngẫu nhiên thành 2 nhóm, mỗi nhóm 35 bệnh nhân, nhóm nghiên cứu sử dụng Isotretinoin 20 mg / ngày và Vit D 1000 UI / ngày, nhóm chứng chỉ sử dụng Isotretinoin 20 mg / ngày trong 3 tháng điều trị."
,Kết quả: Cả nhóm nghiên cứu và nhóm chứng có sự khác biệt có ý nghĩa thống kê về mức độ nặng của bệnh trứng cá thông thường và điểm số GAGS tại thời điểm 1 - 2 - 3 tháng sau điều trị so với trước điều trị.
,"Sau 3 tháng, cả hai nhóm nghiên cứu và nhóm chứng đều cho kết quả rất tốt, tốt và khá ở hơn 90% bệnh nhân."
