English,Vietnamese
,"Đối tượng và phương pháp nghiên cứu: Nghiên cứu cắt ngang mô tả được thực hiện trong thời gian 08/01/2020 trên 385 bệnh nhân tăng huyết áp điều trị ngoại trú tại phòng khám Nội Tim mạch, Bệnh viện Đại học Y Dược Thành phố Hồ Chí Minh."
,"Kết quả: Đa số bệnh nhân được chỉ định điều trị phối hợp (79,5%)."
,"Kết hợp thuốc đơn trị, 2 thuốc, 3 thuốc và 4 thuốc trở lên lần lượt là 20,5%; 32,7%; 30,9%; và 19,9%."
,"Thuốc chẹn thụ thể angiotensin II được kê đơn nhiều nhất (84,2%), kế đến là thuốc chẹn beta (60,8%) và thuốc chẹn kênh canxi (50,4%)."
,"Đối với liệu pháp phối hợp, thuốc chẹn thụ thể angiotensin II và thuốc chẹn beta được sử dụng nhiều nhất (41,3%)."
,"Tỷ lệ kê đơn phối hợp liều cố định chiếm khoảng một nửa dân số (47,4%)."
,"Đặc điểm lâm sàng, cận lâm sàng và kết quả phẫu thuật u dưới màng cứng vùng ngực và thắt lưng"
,Đánh giá mức độ stress của nhân viên y tế bị nhiễm COVID-19 tại Bệnh viện Trung ương Quân đội 108 và một số yếu tố liên quan năm 2022.
,Đối tượng và phương pháp: Nghiên cứu mô tả cắt ngang được tiến hành trên 210 nhân viên y tế đủ tiêu chuẩn nghiên cứu.
,Thang đo DASS-21 được sử dụng để đánh giá mức độ stress của nhân viên y tế.
,"Các yếu tố nghề nghiệp được xem xét bao gồm thời gian, điều kiện làm việc, áp lực làm việc, biện pháp phòng ngừa nhiễm khuẩn."
,"Kết quả: 76,7% đối tượng tham gia nghiên cứu bị stress mức độ nhẹ và vừa, trong đó nhóm điều dưỡng chiếm 55,2%."
,"Mức độ stress của nhân viên y tế có mối liên quan có ý nghĩa thống kê với các yếu tố nghề nghiệp bao gồm số giờ làm việc trung bình / ngày (OR  1,96; KTC 95%: 1,02-3,74, p  0,05), áp lực từ phản ứng tiêu cực của bệnh nhân / gia đình (OR  2,23; KTC 95%: 1,17-4,28; p  0,05)."
,"Kết luận: Tỷ lệ điều dưỡng, bác sĩ bị stress khá cao."
,"Cần quan tâm hơn nữa đến nhân viên y tế cũng như thực hiện cải thiện chính sách, môi trường và chế độ làm việc để giảm áp lực cho họ."
,"Kiến thức phòng chống nhiễm giun truyền qua đất của phụ nữ dân tộc thiểu số từ 15-49 tuổi tại xã Đăk Wil, huyện Cư Jut, tỉnh Đắk Nông năm 2021"
,"Đặc điểm lâm sàng, kết quả điều trị phẫu thuật giải ép vi mạch chèn ép thần kinh VII và V trong phẫu thuật CPA."
,Đối tượng và phương pháp: 106 bệnh nhân được chẩn đoán và phẫu thuật tại khoa Ngoại thần kinh bệnh viện Việt Đức trong 3 năm (từ tháng 1/2019 đến tháng 12/2021).
,Nghiên cứu mô tả kết hợp hồi cứu và hồi cứu.
,Kết quả: Tỷ lệ nữ / nam trong phẫu thuật điều trị xung đột mạch máu và phức hợp thần kinh V và VII là trên 2.
,Vị trí chèn ép mạch máu thần kinh chủ yếu là gần thân não.
,"Tỷ lệ điều trị hiệu quả là 89,62%, biến chứng hay gặp nhất là tê mặt tạm thời (8,62%), nghe kém tạm thời (22,92%)."
,"Kết luận: Nguyên nhân chính gây chèn ép thần kinh V là động mạch tiểu não trên (55,17%), với thần kinh mặt là động mạch tiểu não trước dưới (52,05%)."
,Phẫu thuật giải ép vi mạch mang lại kết quả tốt cho bệnh nhân.
,"tê mặt tạm thời (8,62%), nghe kém tạm thời (22,92%) là những biến chứng thường gặp trong quá trình phẫu thuật."
,"Nhận thức về các yếu tố nguy cơ và dấu hiệu cảnh báo đột quỵ ở người trưởng thành thành phố buôn ma thuột, tỉnh đắk lắk"
,Kiến thức phòng chống nhiễm giun truyền qua đất của người dân tộc thiểu số còn hạn chế.
,Hầu hết đối tượng nghiên cứu chưa có kiến thức đúng về phòng bệnh.
,"Gần một nửa số người tham gia nghiên cứu không bao giờ nhận được bất kỳ thông tin nào về phòng chống nhiễm giun truyền qua đất, trong khi hầu hết những người tham gia đều muốn nhận được thông tin về phòng chống bệnh."
,"Với phụ nữ trong độ tuổi sinh đẻ, nhiễm giun truyền qua đất ảnh hưởng đến thai kỳ và gây thiếu máu, sinh non, trẻ nhẹ cân, thậm chí tử vong mẹ và con."
,Phương pháp nghiên cứu: Nghiên cứu mô tả cắt ngang trên 309 phụ nữ dân tộc thiểu số từ 15-49 tuổi bằng phương pháp chọn mẫu ngẫu nhiên hệ thống.
,"Thời gian nghiên cứu từ tháng 1 năm 2021 đến tháng 7 năm 2021, địa điểm nghiên cứu là xã Đăk Wil, huyện Cư Jut, tỉnh Đắk Nông."
,"Kết quả: Tỷ lệ phụ nữ biết về bệnh giun đũa chó mèo chiếm tỷ lệ cao nhất (50,48%), tiếp theo là giun đũa chó mèo (34,95%) và cuối cùng là giun tóc (26,86%)."
,"89,81% người dân tham gia nghiên cứu có kiến thức kém về nhiễm giun truyền qua đất."
,"Tỷ lệ người dân tiếp cận thông tin và giao tiếp còn thấp (56,31%) trong khi hầu hết người dân (98,38%) mong muốn được tiếp nhận thông tin về phòng chống nhiễm giun truyền qua đất."
,"Phần lớn thông tin nhận được từ nhân viên y tế (62,64%)."
,Kết luận: Tỷ lệ phụ nữ dân tộc thiểu số thiếu kiến thức còn cao.
,Kết quả sống thêm lâu dài của phương pháp tắc mạch hoá chất ở bệnh nhân ung thư biểu mô tế bào gan
,"Không có sự khác biệt về nhận thức giữa những người có tăng huyết áp, đái tháo đường và rối loạn lipid máu với những người không có những đặc điểm này."
,Kết luận: Nhận thức kém về các yếu tố nguy cơ và dấu hiệu cảnh báo đột quỵ ở người lớn trong cộng đồng còn cao.
,"Các yếu tố liên quan đến nhận thức kém về cả hai yếu tố nguy cơ đột quỵ và dấu hiệu cảnh báo là tuổi, trình độ học vấn, nghề nghiệp."
,"Nhận thức kém về các yếu tố nguy cơ đột quỵ liên quan đến dân tộc thiểu số, và nhận thức kém về các dấu hiệu cảnh báo của đột quỵ liên quan đến tiền sử gia đình có người thân bị đột quỵ."
,"Mục tiêu: Xác định nhận thức kém về các yếu tố nguy cơ và dấu hiệu cảnh báo đột quỵ ở người trưởng thành tại thành phố Buôn Ma Thuột, tỉnh Đắk Lắk và một số yếu tố liên quan đến nhận thức kém này."
,"Phương pháp nghiên cứu: Nghiên cứu mô tả cắt ngang trên 464 đối tượng tham gia nghiên cứu tại thành phố Buôn Ma Thuột, tỉnh Đắk Lắk."
,Chúng tôi sử dụng bộ câu hỏi thiết kế sẵn để thu thập số liệu từ các đối tượng thông qua phỏng vấn trực tiếp.
,"Kết quả: Trong tháng 1 năm 2020, chúng tôi đã tuyển chọn được 464 người tham gia."
,"Kết quả cho thấy có 67,9% và 76,1% người tham gia có nhận thức kém về các yếu tố nguy cơ và dấu hiệu cảnh báo đột quỵ."
,"Các yếu tố liên quan đến nhận thức kém về các yếu tố nguy cơ đột quỵ là tuổi cao (65 tuổi trở lên), dân tộc thiểu số, trình độ học vấn thấp và nghề nông."
,"Các yếu tố liên quan đến nhận thức về dấu hiệu cảnh báo đột quỵ là tuổi cao, trình độ học vấn thấp, nghề nghiệp và tiền sử gia đình có đột quỵ hiếm gặp."
,Tình trạng dinh dưỡng ở trẻ 6 tháng đến 5 tuổi tại phòng khám dinh dưỡng bệnh viện Nhi Trung ương
,Khảo sát hiệu quả của phương pháp nút mạch hoá chất và các yếu tố tiên lượng ảnh hưởng đến bệnh nhân ung thư biểu mô tế bào gan.
,Child-Pugh A trước TACE và đáp ứng khối u (CR / PR) là những yếu tố tiên lượng khả quan.
,Đối tượng và phương pháp: Tổng cộng có 477 bệnh nhân được chẩn đoán xác định ung thư biểu mô tế bào gan được điều trị bằng phương pháp nút mạch hoá chất (TACE).
,"Bệnh nhân sống được đánh giá bằng phương pháp Kaplan-Meier, các yếu tố tiên lượng ảnh hưởng đến sống còn được đánh giá bằng các phép kiểm log-rank và hồi quy nguy cơ Cox."
,"Kết quả: Trong số 477 bệnh nhân (437 nam, tuổi trung bình 61,1  11,7) được TACE, thời gian theo dõi trung bình là 25,3 (1  63) tháng."
,"Đáp ứng khối u theo RECIST cải tiến ở bệnh nhân theo dõi trên 6 tháng bao gồm đáp ứng hoàn toàn (CR) với điều trị ở 41 bệnh nhân (8,7%), đáp ứng một phần (PR) ở 352 (74,9%), bệnh ổn định (SD) và bệnh tiến triển (PD) ở 77 (16,1%)."
,"Trung vị thời gian sống thêm toàn bộ (OS) là 53  1,1 tháng."
,"Các yếu tố liên quan đến thời gian sống thêm toàn bộ dài hơn bao gồm ECOG  1, Child-Pugh A, BCLC giai đoạn A / B, ALBI độ I, và đáp ứng khối u (CR / PR). Trong phân tích đa biến, Child-Pugh A và đáp ứng khối u khách quan (CR / PR) là các yếu tố dự báo thời gian sống thêm toàn bộ dài hơn."
,Kết luận: TACE là phương pháp điều trị hiệu quả cho ung thư biểu mô tế bào gan.
,Mật độ xương và một số yếu tố liên quan ở phụ nữ mãn kinh
,"Qua đo mật độ xương bằng phương pháp siêu âm định lượng tại phòng khám đa khoa, trường Đại học Y khoa Vinh, Nghệ An, nghiên cứu đã khảo sát mật độ xương và các yếu tố liên quan đến mật độ xương của 203 phụ nữ mãn kinh."
,"Kết quả cho thấy 23,2% phụ nữ mãn kinh nghiên cứu có mật độ xương bình thường; 51,7% giảm mật độ xương và 25,1% có loãng xương; tuổi càng cao, mật độ xương càng giảm, tỷ lệ loãng xương càng tăng (tỷ lệ loãng xương là 42,6% ở tuổi 70 trở lên); thời gian mãn kinh càng dài thì tỷ lệ loãng xương càng tăng."
,Kết quả phẫu thuật ung thư tuyến giáp thể nang
,"Dinh dưỡng đóng vai trò quan trọng trong sự phát triển và phát triển của trẻ, đặc biệt là trẻ dưới 5 tuổi."
,Trẻ có cân nặng lúc sinh thấp (dưới 2500 g) có xu hướng giảm cân sau này về sinh hoạt.
,Kết luận: Suy dinh dưỡng ở trẻ dưới 5 tuổi vẫn còn là một thách thức lớn ở trẻ dưới 5 tuổi.
,Cân nặng sơ sinh có liên quan đến tình trạng dinh dưỡng.
,Mục tiêu: Đánh giá tình trạng dinh dưỡng và các yếu tố liên quan của trẻ từ 6 tháng đến 5 tuổi đến khám tại Phòng khám Dinh dưỡng Bệnh viện Nhi Trung ương.
,Đối tượng và phương pháp nghiên cứu: Nghiên cứu mô tả cắt ngang trên 234 trẻ từ 6 tháng đến 5 tuổi đến khám tại Phòng khám Dinh dưỡng Bệnh viện Nhi Trung ương từ tháng 9/2020 đến tháng 6/2021.
,"Kết quả: 56,0% đối tượng được bú mẹ hoàn toàn trong vòng 1 giờ sau sinh."
,"Cho ăn bổ sung khi 6 tháng tuổi là 87,0% và 67,9% được cung cấp với tất cả các nhóm thực phẩm."
,Đặc điểm nồng độ homocysteine ở bệnh nhân đái tháo đường typ 2 có loét bàn chân
,"Kết quả: Tỷ lệ bệnh nhân được phẫu thuật cắt toàn bộ tuyến giáp và cắt thuỳ là 75% và 25%, trong mỗi nhóm phẫu thuật bóc tách cổ được thực hiện lần lượt là 66,7% và 0%."
,"Đa số bệnh nhân ở giai đoạn I (75%), 12,5% bệnh nhân ở giai đoạn IV."
,"Biến chứng thường gặp nhất là tổn thương thần kinh thanh quản tái phát thoáng qua và hạ canxi máu, với tỷ lệ xuất hiện tại thời điểm 72 giờ sau phẫu thuật là 14,6% và 18,8%."
,Một bệnh nhân bị suy tuyến cận giáp dai dẳng sau 14 tháng theo dõi.
,"Bóc tách hạch cổ làm tăng nguy cơ hạ canxi máu sau mổ có ý nghĩa thống kê (p  0,05)."
,Kết luận: Phẫu thuật ung thư tuyến giáp thể nang an toàn và hiệu quả.
,Kết quả hoá xạ trị đồng thời với xạ trị điều biến thể tích xạ trị trên bệnh nhân ung thư phổi không tế bào nhỏ giai đoạn III
,Nghiên cứu nồng độ homocystein (Hcy) ở bệnh nhân đái tháo đường típ 2 có loét bàn chân.
,"Đối tượng và phương pháp nghiên cứu: 401 đối tượng là bệnh nhân điều trị nội trú tại Bệnh viện Nội tiết Trung ương từ tháng 11/2014 (47 bệnh nhân trong nhóm chứng, 176 bệnh nhân đái tháo đường típ 2 có loét bàn chân và 178 bệnh nhân đái tháo đường típ 2 không loét bàn chân)."
,Phương pháp nghiên cứu: Nghiên cứu mô tả cắt ngang.
,"Kết quả: Nồng độ Homocytein trung bình ở nhóm chứng là 7,49  1,25; nhóm ĐTĐ không có loét bàn chân là 9,38  4,96 và ĐTĐ có loét bàn chân là 12,69  4,91 (p  0,001)."
,"Nồng độ Homocystein ở nam cao hơn ở nữ (ĐTĐ có loét chân: nữ 13,66  4,86 so với nam 11,27  4,66; ĐTĐ không có loét chân: nữ 10,43  5,34 so với nam 8,70  2,76; p  0,05)."
,Nồng độ Homocystein ở nam cao hơn ở nữ; bệnh nhân tăng huyết áp cao hơn bệnh nhân không tăng huyết áp.
,Nghiên cứu so sánh hàm lượng các hợp chất sinh học và sự đa dạng di truyền của loài Polyscias sp
,"Với kỹ thuật VMAT, một loạt các hình dạng trường nhỏ được tạo ra từ mỗi chùm tia."
,Trọng lượng tương đối của từng thành phần dự án sẽ được tối ưu hoá trên mỗi thành phần dự án.
,"Để thực hiện đề tài này, chúng tôi sử dụng phương pháp tối ưu hoá trực tiếp hiệu suất gắn kết."
,Nghiên cứu nhằm đánh giá kết quả và tác dụng không mong muốn của hoá xạ trị đồng thời VMAT trong điều trị ung thư phổi không tế bào nhỏ giai đoạn III tại Bệnh viện K.
,"Từ tháng 6/2017, chúng tôi đã thực hiện kỹ thuật này trên 30 bệnh nhân UTPKTBN."
,"Kết quả cho thấy kỹ thuật xạ trị điều biến liều VMAT có ưu điểm so với kỹ thuật xạ trị 3D trong kế hoạch điều trị như chỉ số HI, CI, UI, V95 tại PTV; V105, thể tích cơ quan nhận liều xạ; tỷ lệ đáp ứng một phần chiếm 80%; tỷ lệ sống thêm toàn bộ 24 tháng là 64% và tỷ lệ sống thêm toàn bộ 24 tháng là 64%."
,Nâng cao giá trị bổ sung của xuất khẩu chè Việt Nam
,Các yếu tố môi trường và giai đoạn sinh trưởng thực vật có thể ảnh hưởng đáng kể đến hàm lượng chất hoá học của cây cao hơn.
,Nghiên cứu này được thực hiện nhằm đánh giá ảnh hưởng của điều kiện sinh học và giai đoạn phát triển thực vật đến hàm lượng một số hợp chất sinh học và sinh năng lượng của cây rau má.
,"Nghiên cứu được thực hiện tại các phòng thí nghiệm của trường Đại học Cần Thơ, từ tháng 1 đến tháng 12 năm 2020."
,"Kết quả cho thấy: giai đoạn tăng trưởng và các bộ phận thực vật ảnh hưởng đáng kể đến tổng hàm lượng thiamine, axit tannic, quercetin và các hợp chất veratrine trong cây này."
,Ảnh hưởng của vật liệu nha khoa đến các thông số nha chu của răng hàm trên đã được điều trị nội nha và phục hình thân răng
,"Trong bối cảnh hội nhập kinh tế quốc tế sâu, điều cần thiết là Việt Nam phải tạo ra những bước đột phá nhằm khẳng định chất lượng và sự phục vụ của các sản phẩm nông nghiệp nói chung và các sản phẩm chè nói riêng."
,"Những đột phá này nên được thực hiện từ sản xuất đến giai đoạn chế biến để đạt được những cải tiến bền vững và nâng cao giá trị của sản phẩm chè Việt Nam, tạo ra thương hiệu chè Việt Nam."
,"Mặc dù Việt Nam có nhiều tiềm năng và đã có những nỗ lực, nhưng việc nâng cao giá trị bổ sung cho trà Việt Nam vẫn còn gặp nhiều khó khăn và thách thức."
,Điều quan trọng là Việt Nam phải có các giải pháp để giúp các sản phẩm chè Việt Nam vào các chợ lớn trên thế giới và nâng cao giá trị bổ sung của xuất khẩu chè Việt Nam trong thời gian tới.
,"Kiến thức, thái độ và các yếu tố liên quan đến an toàn người bệnh của nhân viên y tế tại bệnh viện đa khoa huyện Mộc Châu, tỉnh Sơn La năm 2019"
,Đánh giá hiệu quả của các loại vật liệu nha khoa (cả phục hình và phục hình kim loại) sử dụng để làm ảnh hưởng đến các mô nướu xung quanh.
,"Đối tượng và phương pháp nghiên cứu: 20 bệnh nhân có răng cối lớn hàm trên đã được điều trị tuỷ tại Khoa Lâm sàng 3, Khoa Răng Hàm Mặt, Đại học Y Dược Thành phố Hồ Chí Minh, được chọn vào nghiên cứu."
,"Các đối tượng được chia thành 2 nhóm, gồm 10 đối tượng được điều trị bằng tất cả các loại phục hình và 10 đối tượng còn lại được điều trị bằng phục hình bằng phục hình bằng sứ kim loại. Các thông số nha chu được ghi nhận ngay sau khi gắn mão, 45 và 90 ngày sau đó."
,"Kết quả: Các thông số lâm sàng nha chu tại thời điểm gắn mão, 45 và 90 ngày sau gắn mão không có sự khác biệt có ý nghĩa thống kê giữa hai nhóm sử dụng mão toàn sứ và mão sứ kim loại."
,"Răng giả làm tăng nhẹ chỉ số mảng bám và chỉ số lợi ở cả hai nhóm nhưng không có sự khác biệt có ý nghĩa thống kê (p > 0,05)."
,Kết luận: Không có sự khác biệt có ý nghĩa thống kê về ảnh hưởng của việc sử dụng tất cả các loại phục hình răng sứ hoặc phục hình răng sứ lên các chỉ số mô nướu.
,"Một số chỉ số sức khoẻ, hành vi nguy cơ và sử dụng dịch vụ y tế của thanh thiếu niên dân tộc Chăm tỉnh An Giang năm 2019"
,"Nghiên cứu này được thực hiện nhằm mô tả kiến thức, thái độ và phân tích một số yếu tố liên quan đến an toàn người bệnh tại Bệnh viện đa khoa huyện Mộc Châu, tỉnh Sơn La bằng phương pháp mô tả cắt ngang."
,"Kết quả cho thấy đối tượng có kiến thức đúng về an toàn người bệnh chiếm 60,6%."
,"Nguyên nhân hàng đầu gây sai sót y khoa hoặc mất an toàn chăm sóc sức khoẻ người bệnh là sai sót cá nhân (89,4%), sai sót hệ thống (59,4%) và quản lý, điều trị và môi trường (50%)."
,Tất cả nhân viên y tế đều bị tai nạn y tế với hậu quả nặng nề (trên 98%).
,"Tỷ lệ người bệnh có thái độ đúng về an toàn người bệnh rất cao (99,4%)."
,"Các yếu tố liên quan đến kiến thức và thái độ về an toàn người bệnh của nhân viên y tế được tìm thấy là trình độ học vấn, và thời gian làm việc trung bình hàng tuần."
,Đánh giá việc sử dụng erythropoietin ở bệnh nhân suy thận mạn giai đoạn cuối lọc máu chu kỳ tại Bệnh viện Thận Hà Nội
,"Để nâng cao chất lượng dịch vụ chăm sóc sức khoẻ cho trẻ vị thành niên Chăm trong thời gian tới, nghiên cứu đã mô tả một số chỉ số sức khoẻ, hành vi nguy cơ và sử dụng dịch vụ chăm sóc sức khoẻ, dựa trên những yếu tố này, chúng tôi tiến hành đề tài Giải pháp cấp thiết và cấp bách cho chăm sóc sức khoẻ đồng bào dân tộc thiểu số trong nước."
,"Dựa vào điều này, các gia đình và trường học cần được khuyến khích và chia sẻ ngay khi có dấu hiệu chán nản, để tránh những ảnh hưởng tiêu cực đến học tập của họ, cha mẹ và thanh thiếu niên nên đến phòng khám y tế để điều trị khi bị bệnh, không điều trị tại nhà."
,Đánh giá ảnh hưởng đến sức mạnh nắm nắm bàn tay khi thay đổi tư thế khuỷu tay và cổ tay ở người từ 20 đến 39 tuổi
,Điều trị và kiểm soát thiếu máu đóng vai trò quan trọng trong việc nâng cao chất lượng và hiệu quả của thận nhân tạo.
,Nghiên cứu được tiến hành trên 61 bệnh nhân thoả tiêu chuẩn lựa chọn và không được đưa vào nhóm chứng.
,"Thu thập số liệu từ hồ sơ bệnh án bằng phương pháp hồi cứu, mô tả, theo dõi dọc trong 6 tháng."
,Số liệu được xử lý bằng phần mềm Microsoft Excel Office 2010 và R. Kết quả cho thấy bệnh nhân sử dụng đồng thời cả EPO alpha và EPO beta.
,Dạng đông khô (EPO alpha) được sử dụng phổ biến nhất.
,"Không có bất thường về huyết áp, bạch cầu, tiểu cầu, điện giải."
,Tỷ lệ tiền đái tháo đường típ 2 ở người từ 25 tuổi trở lên tại tỉnh Thái Bình
,"Nghiên cứu mô tả cắt ngang được thực hiện năm 2017, với phương pháp chọn mẫu cụm (PPS) để chọn 30 xã / phường tại 8 huyện / thành phố Thái Bình."
,"Tổng số 1450 người trưởng thành từ 25 tuổi trở lên và xét nghiệm đường huyết mao mạch bằng Accu-Chek - D 10 - BIO-RAD, kết quả cho thấy: Tỷ lệ tiền đái tháo đường là 15,2%; nam giới là 18,6%, cao hơn so với nữ giới, chiếm 11,3% (p  0,05)."
,"Tỷ lệ tiền đái tháo đường có xu hướng tăng dần theo nhóm tuổi, ở nhóm tuổi từ 70 trở lên, tỷ lệ cao nhất (17,3%), tuổi từ 60-69 (19,6%), nhóm tuổi 40-59 chiếm 17,0% và thấp nhất nhóm tuổi 25-39 chiếm 5,1% (p  0,05)."
,Tỷ lệ tiền đái tháo đường cao hơn ở nhóm nghề nghiệp ổn định.
,"Sự khác biệt giữa các nhóm nghề nghiệp có ý nghĩa thống kê (p  0,05)."
,Một số yếu tố liên quan đến mệt mỏi ở bệnh nhân suy thận mạn lọc máu chu kỳ tại một số bệnh viện ở thành phố Nam Định
,Tìm hiểu một số yếu tố liên quan đến sự hài lòng của sinh viên sau đại học đối với thực hành mô phỏng tại Trung tâm thực hành tiền lâm sàng Trường Đại học Điều dưỡng Nam Định.
,Phương pháp nghiên cứu: Nghiên cứu định lượng được thực hiện trên 200 sinh viên điều dưỡng chính quy sau khi kết thúc khoá học thực hành mô phỏng tại trung tâm thực hành tiền lâm sàng.
,Những sinh viên này sử dụng bộ công cụ thiết kế sẵn để đánh giá sự hài lòng của sinh viên về thực hành mô phỏng và tìm hiểu một số yếu tố liên quan đến sự hài lòng đó.
,"Kết quả: Có 4 yếu tố ảnh hưởng đến sự hài lòng của sinh viên khi học thực hành mô phỏng, bao gồm: Cơ sở vật chất; Giảng viên; Nhận thức của sinh viên; thời gian học tập và nhóm thực hành mô phỏng."
,"Trong nghiên cứu và thẩm định mô hình hồi quy, 4 thành phần đề xuất là phù hợp và có ý nghĩa thống kê."
,"Trong 4 thành phần được xác định trong mô hình nghiên cứu, mức độ ảnh hưởng của các thành phần khác nhau đến sự hài lòng của sinh viên về thực hành mô phỏng học tập tại các trung tâm tiền lâm sàng."
,"Cụ thể, ảnh hưởng đến sự hài lòng của sinh viên là thành phần khoa học (Beta  0,136); thứ hai là thành phần học tập (Beta  0,226); thứ ba là thành phần học tập Thời gian và phân nhóm thực hành mô phỏng (Beta  0,095) và thành phần cuối cùng là cơ sở vật chất (beta  0,419)."
,ĐÁNH GIÁ KẾT QUẢ ĐIỀU TRỊ TÓM TẮT Nghiên cứu can thiệp lâm sàng không nhóm chứng tại bệnh viện đa khoa tỉnh Thừa Thiên Huế
,"Lực nắm là một phần cụ thể của ""cơ lực"" của chi trên cần được sử dụng để kéo hoặc nắm lấy vật."
,Kết luận: Nghiên cứu này cho thấy các tác động khác nhau lên sức mạnh nắm nắm khi người bệnh sử dụng các bàn tay khác nhau có sự thay đổi ở vị trí khuỷu tay và cổ tay.
,Lực nắm ở bàn tay thuận là tối đa với khuỷu tay duỗi hoàn toàn và cổ tay ở tư thế trung gian.
