English,Vietnamese
"+ middle:  as  Slide and portal/Frontal (the stool with no closed cleft containing lens, ceramic) and floor after removing the hook/Front/Front.",
Motorbike people are injured during the crash with other motor vehicle and are not identified in non- traffic accident,
"Postpsoriasis juvenile arthritis (K50.Z), unidentified location",
Death due to sequelae of obstetric causes,
"Other medical equipment and unknown related to complications: other equipment, unclassified elsewhere",
Injuries caused by cold injuries affect multiple body regions and unidentified,
Complete lower extremity deficiency,
Fluid meningitisDue to other and unknown etiology,
Superficial lesions of the shoulder and arm,
Burns and airway erosion,
"Osteonecrosis of bone in compressive airway diseases (diversity) (T70.3), forearm",
Intention to suicide with longer guns,
"Tumors of the heart, mediastinum, and pleura",
"Tuberculous pleural tuberculosis, which does not reflect bacterial and histologic confirmation",
Mechanical complications of artificial and transplant,
"Other vertebral adhesions, multiple spine sites",
Clushing  of the pinna or external ear canal,
Other diseases of the middle ear and mastoid,
"Fractures of ribs, sternum, and thoracic spine",
"Bleeding due to deficiency of coagulation factors (O46.0, O67.0, O72.3)",
Severe motor drivers injuries injuries injuries with other injuries: Injuries in non traffic accidents,
Complications in the upper extremity injuries,
"Abrasion of lesions 90% or more, body surface",
"Drug poisoning is mainly systemic and hematologic, unclassified elsewhere",
"Cervical epithelial neoplasia (CIN), grade III, with or without severe dysplasia",
"Irritable bowel syndrome, with primarily diarrhea [IBS-D]",
Injuries of the thumb tendon and flexion in the forearm,
"The basic feature is persistent concern about the likelihood of one or more severe progressive body disorders Patients complain persistently of the body or persistent concerns of their appearance, normal or abnormal feelings are always impaired by the patient as abnormal and distressing, and attention is often focused on one or two body system organs; marked depression and anxiety are often present and may provide additional dia",
Anorectal abscess with or without fistula,
Abnormal results of renal function test,
.0 Injured drivers in non traffic accident,
Family history of other bacterial and parasitic infections,
"Open wounds at trunk, unspecified range",
Cysts of gallbladder or bile ducts,
"during labor, during delivery and after delivery",
"Vaes with other unknown 3-third motor vehicle, not traffically",
Other cardiac and other vascular implants,
+ Cysts due to increased secretion of the salivary gland,
Cerebral hypoxia due to anesthesia during pregnancy,
"Lesions were classified as S47-S48, S57-S58, S67-S68 and T11.6",
"Ocular muscular disease, bilateral ophthalmoplegia and refraction",
Muscle and tendon injuries in the shoulder and upper arm,
Removal of  of unidentified muscles and tendons,
Transient metabolic and endocrine disorders of neonates (P70-P74),
+ Children of mothers with gestational diabetes mellitus (P70.0),
Sev heavy motor drivers injured in Non-cycling traffic accident: People injured on heavy motor drivers in non-cycling traffic accident,
Gallbladder's cholecystectomy without stones,
The traveler who walk or wards on the ray injured by falls in the ray or wards,
Other specific diseases of the anus and rectum,
Other identified diseases of the eyes and ad,
+ muscle and tendon at or below the ankle (S96.-),
"The conditions are listed by the fetus as the reason for monitoring, admission, or other obstetric care for the mother even when they end the pregnancy.",
"Walkingers injuries due to crashing with heavy motor vehicle, bus, non-traffic accidents",
Secondary hypertension due to other kidney disease,
Monitoring pregnant women with abnormal obstetric history (Z35.-),
"Exposure subjects who have feelings, embarrassment, or not respond to sexuality",
People to health facilities in unidentified circumstances,
Specific allergic reactions such as:,
fall or running from the building or burn structure (X00),
Injury of the foot at the unidentified range,
"Myositis in sacoidosis (D86.8), multiple sites",
"objects were taken from or on  motor motor, not on ray",
Other identified pulmonary vascular disease,
Aspiration of fluid or vomit,
"Airway burns, unknown part",
Fet and infants affected by maternal trauma,
Local carcinoma of non-specific respiratory system,
Other undetermined half-limb deficitswith other undetermined extremities,
Exposure of artificial visualization and ultraviolet light,
General counseling and advice on contraception,
"Local carcinoma of the lower extremity skin, including the hips",
"Ulceration due to Varices (lower extremities, any segment)",
"Peripheral nerve injury at birth, unknown",
Traumatic and unidentified body injuries,
Muscle and tendon injuries of the neck,
HIV-infected macrophages,
Malignant tumors of the short bone of the lower extremity,
+ Pleural empyemano other identifiable (not mentioned bacterial and histologic confirmation),
Keratosis of follicular and peri-cutaneous keratoses [ Kyrle disease],
"Congenital curvature of the long bones of the leg, nonspecific",
Other special examination and physical examination for people with no previously diagnosed disease or no complaints about health.,
+ previous surgery in the perineal or vulva,
Tuberculous pleural effusion (A15-A16),
Other obstructive diseases of the pelvis and ureter,
"The disease caused by other mononuclear parasites, unclassified",
Symptoms and signs related to circulation and respiration,
"Psoriatic arthritis and enteropathy (M07.- *, M09.- *)",
Bike injuries injuries with a walker or animals: Bike injuries in non traffic accidents,
Tumors of bone and cartilage,
Neoplastic tumors that are uncertain or unknown the pituitary nature,
Other undetermined limb hypogonadism  of other undetermined limbs,
Subacute spinal combination degeneration in vitamin B12 deficiency (E53.8),
"Diseases of the esophagus, stomach and duodenum",
Other superficial lesions of the eyelids and periorbital regions,
Motorbike injuries injuries injuries with a walker or animals,
Personal history of other identified medical conditions,
Unidentified disorder and other disorder of smell and taste,
Injuries caused by cold fever that do not identify multiple body regions,
- luput anticoagulation,
Osteoarthritis in hip and pelvis in children,
Congenital fistula of salivary gland (Q38.4),
+ Maternal diabetes mellitus during pregnancy (P70.0),
Superficial lesions caused by cold in other position and unknown,
Perinatal pneumothorax,
+ Pharyngitis  other influenza viruses have been identified,
Pulmonary (and liver) abscess due to amebas with pneumonia (J17.3 *),
Pregnant or adnex of unidentified fetus after delivery,
Medical care or nursing care or monitor healthy children in the following circumstances:,
Personal history of diseases and other diseases,
Delusions with symptoms of schizophrenia,
"Pregnant women and parasitic infections have been classified elsewhere but cause complications for pregnancy, delivery, and postpartum.",
Diabetic cataract (E10-E14 with a fourth order of .3),
Other staphylococcus is the cause of other diseases classified in chapter,
"Other forms of scoliosis, thoracolumbar region",
The disease of synovial and nonspecific tendon,
"Drug poisoning Carbonic anhydrase inhibitors, benzothladiazide, and other diuretics",
Other identified bilocular ophthalmomotor disorders,
Plasmodium vivax malaria with other complications,
"Adult spinal ossification, multiple spine sites",
Personal history allergic to other antibacterial agents,
Vaccination against jaundice,
Burn injury 30 - 39% of body surface,
Abnormal physiological development as expected,
Injuries caused by cold injuries in multiple body regions,
"A acute mental disorder in which there are diverse and unstable clinical presentations as described in F23.0, although unstable, often has several symptoms characteristic of schizophrenia for most of the time not present. If schizophrenia persists, this diagnosis should be changed as schizophrenia (F20.-).",
"Difficulty walking, unclassified elsewhere",
Problems related to unidentified psychosocial circumstances,
Diabetes Non-dependent insuline (with neurological complications),
"Systemic lesions of connective tissue, nonspecific",
Skin disorders and body temperature regulation of fetus and neonates,
"Inadvertent poisoning and inadvertent exposure to substance and psychotic drugs (hallucinogens), unclassified elsewhere",
Health monitoring and care of neglect children,
People who swing animals or people who walk on an injured traffic vehicle injured with motor vehicle have known other characteristics.,
Upper extremity artery aneurysms,
Burns injury 80 - 89% of body surface,
Cerebral artery lesions,
Physical screening for cardiovascular disorders,
"+ Abnormal  of ureteropelvic junction, ureteropelvic junction",
Complications of some early complications of trauma,
"Chronic nephritic syndrome, minimal glomerular abnormalities",
The situation of pus and necrosis of lower airways,
+ surgery and obstetric procedures (O75.4),
Other identified lesions in the shoulder and upper arm,
Fetal growth retardation and malnutrition,
- The nasopharynx ( anterior) ( posterior) of soft palate,
Injury  of unidentified vessels,
Other congenital anomalies of renal arteries,
"Scoliosis due to thoracic abnormalities, multiple spine sites",
Side effects of appropriate drugs or pharmaceuticals used correctly,
Behavioral and emotional disorders often begin in childhood and adolescence,
"A acute psychotic disorder in which hallucinations, delusions, or cognitive disorders are apparent but significantly variable, changing from day to day, even from day to day Emotional disorders with intense paralytic feelings of life or beats or anxiety or irritability are also common. The diversity and unstable feelings are characteristic of the entire clinical picture and the characteristics of these psychotic disorders do not provide the diagnosis",
"The child is not small or underweight compared to gestational age, presenting with signs of malnutrition such as dry skin, sloughing, and loss of subcutaneous fat.",
Maternal care for vaginal varices during pregnancy (O22.1),
+ Obstructive - non necrotic embolization,
Anti-receptor adrenalin not used in the treatment of asthma (T44.5),
Multiple cerebellar system atrophy [MSA-C],
Dengue fever without red flag findings,
Any condition in I83.9 both ulcer and inflammation,
"Progressive, minimal glomerular abnormalities",
"Other unknown accidents of 3-channel motor vehicle, not motor vehicle crashes",
Family history of blindness and visual loss,
"Other viral infections, unclassified",
Bleeding  due to prosthetic heart valves,
People outside the agricultural vehicle injured in tra tra tra tra traffic accident,
- Non-specific folic acid deficiency anemia,
Personal history of neurologic and sensory diseases,
"Lower extremity open wounds, unspecified range",
Malignant tumors with invasive lesions of the respiratory and intrathoracic organs,
Tubitis  according to classification status in O00-O07,
+ Dry syndrome [Sjogren] (M35.0),
Benign lipomas of other sites,
Myelopathy and periodontal tissue and unknown,
+ Sinus (any sinus)  no other identification (not mentioned bacterial and histologic confirmation),
"Neoplasms that are unknown or unknown the nature of the middle ear, respiratory and intrathoracic organs",
Excess in the trunk of undetermined grade,
Multiple superficial lesions in the lower leg,
"+ intracranial, infected spine or surgical spine (G08)",
Growth delay after malnutrition due to protein - energy deficiency (E45),
Superficial lesions of the lip and oral cavity,
"Nonspecific kyphosis, chest region",
Fractures of the wrist and hand,
"Nonspecific kyphosis, multiple spinal sites",
Lack of factor VIII with vascular wall damage (D68.0),
"Microscopic arthropathy after metabolic disorders that have been classified elsewhere, the legs",
"Other congenital deformities of the skull, face, and jaws",
+ Failure (acute) - according to classification status in O00-O07,
Abnormal maternal biochemical signs on prenatal examination,
Other specific infections in perinatal period,
Poisoning due to c c c (T61.2),
Other changes of male genitals,
Esophageal adhesion of the esophagus,
"+  coal  used in steam, traveler, barbecue meat cooking, or mobile (mobile).",
Symptoms and Signs related to language and voices,
+ wide ligament  according to classification status in O00-O07,
Other specific disorders in bone density and structure,
Speech disorders are characterized by frequent prolongation or repetition of sounds or verbs or words that are usually independently or stopped to arrhythmia of speech... It should be classified only when it is severe enough to interfere with speech involvement.,
The subtypes of disease markers in this chapter include:,
Ear- nose- throat in relation to accident,
Secondary malignant tumors are other locations and unidentified,
The goal of disc disc disc disc disc disc disc disc disc disc disc disc disc disc disc disc disc disc disc,
"Malignant tumor of small gastric curve, non-specific",
- Nitro and amino acid derivatives of benzen and isolates (T65.3),
Failure and elimination of unidentified organ and organ transplantation,
+ disease or lesions  unknown  of the spinal cord or meninges,
Late-onset Alzheimer disease,
"Malignant tumors of ribs, sternum, and clavicle",
The umbilical suspension in delivery of amniotic fluid,
"Dislocations, sprains, muscle tension involving the head and neck",
Toxicity of acid caustic acid and acid products,
The statistical status at T82.0 due to coronary artery and transplant valve,
Root compression and plexus in lumbar disc disease (M50-M51),
Other congenital infections and parasites,
Insulin-independent diabetes mellitus (with other identified complications),
"Complications due to prosthetic joint transplantation, transplantation, orthopedic (T84.-)",
Muscle deformity of head and face (Q67.0-Q67.4),
"Obstruction, closure and congenital colonic contraction",
Multiple cranial nerve paralysis in tumors (C00-D48),
Congenital malformation syndromes causing multiple system involvement (Q87.-),
Other identified myelopathy,
"A disorder is characterized by partial or complete loss of normal integrity between past memory, self-consciousness and temporary sensation, and control of body movements (see F44.-) but manifests as a consequence of a physical disorder.",
"Other infections are transmitted by animals to humans, not classified elsewhere",
Other specific diseases of biliary,
+ Insufficient rotation of the cecum and intestine,
Unspecified kidney disease other unspecified morphological lesions (N28.9),
"Osteoporosis in other diseases has been classified elsewhere, Many sites",
Falls caused by coving or other accidents of water vehicle,
Burn in the eyelids and periorbital area,
,"Đánh giá đặc điểm lâm sàng, cận lâm sàng của bệnh nhân viêm tai giữa có tràn dịch và V.a tại khoa Tai Mũi Họng  Bệnh viện Trung ương Thái Nguyên"
,"Đánh giá đặc điểm lâm sàng, cận lâm sàng của bệnh nhân tràn dịch tai giữa và V.A tại khoa Tai Mũi Họng - Bệnh viện Trung ương Thái Nguyên."
,Có mối liên quan giữa giãn mạch và rối loạn chức năng âm đạo.
,Tràn dịch tai giữa trên V a là bệnh lý thường gặp ở trẻ em.
,"Triệu chứng chính là viêm mũi, nghẹt mũi, ù tai."
,"Nội soi điển hình là màng nhĩ lõm, màu vàng hoặc bóng."
,Đo nhĩ lượng đồ và thính lực đồ giúp chẩn đoán chính xác mức độ rối loạn chức năng âm đạo.
,Phương pháp nghiên cứu: Mô tả tiến cứu có can thiệp lâm sàng.
,"Kết quả: Tuổi trung bình là 5,1."
,"Triệu chứng thực thể chủ yếu là ù tai (52,6%), viêm mũi, nghẹt mũi (65,8%), không có triệu chứng (23,7%)."
,"Nội soi: Nội soi thường gặp là màng nhĩ lõm, màu vàng hoặc bóng, V ở độ 3 (55,3%), độ 4 (34,2%), độ 1 (0%)."
,"Loại nhĩ lượng đồ: Type C (61%), Type B (32,2%)."
,"Loại As (6,8%), dạng Atlasic (50,8%), phẳng (32,2%)."
,"Phân tích hàm lượng đồng, chì, cadmi và kẽm trong rau má bằng phương pháp ICP-MS"
,"Trong nghiên cứu này, hàm lượng đồng, chì, cadmi và kẽm trong 15 mẫu rau má thu thập tại các tỉnh miền Bắc được xác định bằng ICP-MS. Kết quả của phương pháp bổ sung tiêu chuẩn cho thấy độ thu hồi của phương pháp đối với kim loại đồng, chì, cadmi và kẽm dao động từ 82,19% đến 109,65%."
,"Nồng độ đồng, chì, cadmi và kẽm trong 15 mẫu cây phân tích dao động từ 5,510 - 21,620 mg / kg, 0,481 - 0,628 mg / kg, 0,125 - 0,340 mg / kg, 14,370 - 36,830 mg / kg."
,"Kết quả nghiên cứu cho thấy hàm lượng đồng, chì, cadmi và kẽm trong 15 mẫu thực vật phân tích đều thấp hơn giới hạn cho phép của Tổ chức Y tế Thế giới (WHO) đối với dược liệu."
,Ứng dụng một số phần mềm phân tích barcode dna để xác định cây thuốc
,Việc xác định cây thuốc có mã vạch DNA ngày càng phổ biến do độ chính xác cao.
,"Để xác định sử dụng mã vạch DNA, các nhà nghiên cứu thường sử dụng phần mềm máy tính để phân tích và so sánh mã vạch DNA của các mẫu nghiên cứu với mã vạch có sẵn trên Genbank."
,"Do số liệu trình tự gen được công bố tăng nhanh, để tiến hành phân tích hiệu quả các dữ liệu này, phần mềm cần dễ sử dụng, có thể tính toán nhanh, chính xác và cung cấp nhiều phương pháp thống kê."
,"Trong nhóm phần mềm này, 3 chương trình phần mềm, bao gồm phần mềm BLAST trong NCBI, BioEdit v 7.0.5.2, MEGA 7, thường được sử dụng do đáp ứng các yêu cầu trên."
,Bài báo giới thiệu 3 chương trình phần mềm để xác định các loài cây thuốc với ví dụ minh hoạ về việc xác định các loài cây thuốc thuộc chi Opar (Talinum paniculatum) bằng mã vùng ITS.
,Kết quả nghiên cứu của bài báo cho thấy quy trình kết hợp 3 phần mềm để xác định cây thuốc bằng DNA cho kết quả chính xác nhất.
,Hiệu quả giảm nhạy cảm ngà bằng kem đánh răng P/S của công nhân công ty Havinco tại Hà Nội
,"Do đó, mức độ biểu hiện của các protein tế bào chủ này có thể làm tăng sự xâm nhập của vi rút ảnh hưởng đến các triệu chứng lâm sàng."
,"Các đặc điểm lâm sàng, cận lâm sàng của 297 bệnh nhân COVID-19 được tiếp cận, trình bày 52 mẫu dịch mũi họng được chọn ngẫu nhiên từ các bệnh nhân nặng và nhẹ, được so sánh biểu hiện RNA của ACE2 và TMPRSS2 bằng kỹ thuật realtime-PCR với các cặp mồi đặc hiệu."
,"Kết quả cho thấy TMPRSS2 nhưng không biểu hiện gen ACE2 trong niêm mạc mũi họng và một số chỉ số cận lâm sàng như CRP, PCT, Ferritin, D-Dimer, LDH có thể dự đoán mức độ nặng của bệnh nhân COVID-19 nhưng cần nghiên cứu thêm với cỡ mẫu lớn hơn."
,Nghiên cứu đặc điểm mô bệnh học và một số tế bào miễn dịch trong vi môi trường ung thư đại trực tràng được phẫu thuật tại Bệnh viện Trung ương Quân đội 108
,Mục tiêu: Đánh giá hiệu quả của kem đánh răng chứa tinh dầu P / S trong giảm nhạy cảm ngà ở người trưởng thành.
,Đối tượng và phương pháp: 69 người trưởng thành làm việc tại công ty HANVICO Hà Nội với 182 răng nhạy cảm được đưa vào nghiên cứu.
,"Chúng tôi tiến hành nghiên cứu tiến cứu, mô tả."
,"Kết quả: Sau 4 tuần can thiệp, tỷ lệ răng nhạy cảm giảm 82,4%."
,Tỷ lệ béo phì và đặc điểm của trẻ 6 và 7 tuổi tại thành phố Buôn Ma Thuột
,Nhận xét đặc điểm mô bệnh học của ung thư biểu mô đại trực tràng theo phân loại của WHO 2010.
,Mật độ thấp của tế bào CD68 dương tính thường thấy trong mô đệm khối u và mô đệm khối u nếu có di căn hạch.
,"Nếu không có di căn hạch, mật độ cao của tế bào CD68 dương tính thâm nhiễm cả mô đệm khối u và mô đệm khối u."
,"Sự khác biệt về tương quan giữa tế bào CD4, CD8 và CD68 dương tính với độ mô học, hình thái u, vị trí u và nhóm tuổi không có ý nghĩa thống kê."
,Kết luận: U chủ yếu ở trực tràng và mô bệnh học là ung thư biểu mô tuyến biệt hoá vừa.
,"Tỷ lệ xâm lấn thanh mạc và di căn hạch lần lượt là 45,7% và 31,5%."
,"Tỷ lệ tế bào CD4, CD8 dương tính cao ở nam nhiều hơn nữ và tỷ lệ tế bào CD68 dương tính cao ở giai đoạn T 1 - T 2 nhiều hơn T 3 - T 4."
,Mật độ tế bào CD68 dương tính thấp thường gặp hơn trong các trường hợp di căn hạch.
,"Xác định số lượng tế bào lympho T (CD 4, CD 8) và đại thực bào (CD 68) trong vi môi trường u tuyến đại trực tràng bằng hoá mô miễn dịch và so sánh với một số đặc điểm mô bệnh học."
,Đối tượng và phương pháp: Nghiên cứu trên 127 bệnh nhân ung thư đại trực tràng (trong đó có 50 bệnh nhân ung thư biểu mô tuyến được nhuộm hoá mô miễn dịch) được chẩn đoán tại Bệnh viện Trung ương Quân đội 108 từ tháng 10/2018 đến tháng 7/2019.
,"Kết quả: U chủ yếu gặp ở trực tràng (29,9%)."
,"Ung thư biểu mô tuyến gặp trong 85,8% trường hợp (UTBM tuyến biệt hoá vừa chiếm 84,4%), 45,7% trường hợp có xâm lấn thanh mạc; di căn hạch chiếm 31,5%."
,Mật độ tế bào CD8 dương cao trong tế bào u nest và trong mô đệm u thường gặp ở nam nhiều hơn nữ.
,"Ngược lại, mật độ tế bào CD4 dương tính cao ở tế bào u cao hơn ở nam giới so với nữ giới."
,"Ở giai đoạn T 1 - T 2, mật độ tế bào CD4 và CD68 dương tính cao thường gặp ở mô đệm khối u, trong khi mật độ tế bào CD68 dương tính cao chỉ gặp ở mô đệm khối u."
,"Ở giai đoạn T 3 - T 4, mật độ tế bào CD8 và CD68 dương tính thấp phổ biến hơn ở mô đệm khối u; mật độ tế bào CD68 dương tính thấp ở mô đệm khối u chiếm ưu thế."
,Đặc điểm lâm sàng rối loạn xử lý cảm giác ở trẻ rối loạn phổ tự kỷ
,"Mô tả tình trạng dinh dưỡng, tỷ lệ béo phì và đánh giá mối liên quan giữa khối mỡ cơ thể với chỉ số khối cơ thể của trẻ 6-7 tuổi tại Buôn Ma Thuột."
,"Phương pháp nghiên cứu: Nghiên cứu cắt ngang trên 198 trẻ, bao gồm 127 trẻ 6 tuổi và 71 trẻ 7 tuổi."
,Sử dụng tiêu chuẩn WHO 2007 để chẩn đoán thừa cân - béo phì.
,"Sử dụng phép kiểm định định tính cho các biến số định tính; phép kiểm T cho hai biến độc lập, hồi quy tuyến tính cho các biến số định lượng."
,"Kết quả: Tỷ lệ béo phì của mẫu nghiên cứu là 32,6%, tỷ lệ béo phì ở nhóm 6 tuổi là 33,1% và nhóm 7 tuổi là 31%."
,"Tỷ lệ béo phì ở nam là 33,6% và nữ là 31,0%."
,Có mối tương quan giữa BMI và PBF ở cả hai nhóm tuổi.
,"Ở nhóm 6 tuổi, phương trình hồi quy là BMI  10,78 + 0,257 * PBF, hệ số tương quan R  0,993."
,"Ở nhóm 7 tuổi, phương trình hồi quy là BMI  10,18 + 0,271 * PBF, hệ số tương quan R  0,926."
,Vai trò của FDG PET/CT trong đánh giá giai đoạn bệnh lymphôm mới chẩn đoán
,Rối loạn phổ tự kỷ (RLPTK) là một nhóm các rối loạn xuất hiện sớm trong thời thơ ấu.
,Rối loạn xử lý cảm giác - thính giác là phổ biến nhất và tỷ lệ rối loạn cảm giác cao rõ rệt ở nhóm tự kỷ nặng.
,"Do đó, cần phát hiện sớm và can thiệp sớm."
,"Các bất thường về cảm giác thường làm cho trẻ bị rối loạn phổ tự kỷ khó tiếp nhận, xử lý và đáp ứng với các kích thích cũng như khó điều trị."
,Mục tiêu: Mô tả đặc điểm lâm sàng rối loạn xử lý cảm giác ở trẻ rối loạn phổ tự kỷ.
,Đối tượng và phương pháp nghiên cứu: Nghiên cứu mô tả cắt ngang 75 trẻ rối loạn phổ tự kỷ điều trị tại Bệnh viện Nhi Trung ương từ tháng 8/2021 đến tháng 10/2022.
,"Kết quả: Đối tượng nghiên cứu chủ yếu là nam giới (85,3%); tuổi trung bình 34,92  8,589 tháng; nơi sinh sống chủ yếu ở thành thị (57,4%)."
,"Tuổi trung bình lúc chẩn đoán là 28,72  8,072 tháng."
,"Có đến 90,7% trẻ có ít nhất một rối loạn cảm giác, trong đó rối loạn xử lý cảm giác thính giác chiếm tỷ lệ cao nhất với 81,3%, thấp nhất là rối loạn xử lý cảm giác nội bộ với 20%."
